"EA-Type"	"EA-Package"	"EA-Name"	"EA-GUID"	"EA-Parent"	"EA-Domain"	"EA-Domain-GUID"	"EA-Range"	"label"	"definition"	"usage"	"ap-label-nl"	"ap-definition-nl"	"ap-usageNote-nl"	"ap-codelist"	"external term"	"namespace"	"localname"	"type"	"domain"	"range"	"parent"	"min card"	"max card"
"attribute"	"OSLO-Onderdeel"	"type"	"{67F31B11-4A2F-4696-A13F-E72BC27A5DBA}"	""	"Afsluiting"	"{9C52C045-C441-4ad3-A5BD-C082E3A92A50}"	"KlAflsuitingType"	"type"	"Het type van afsluiting."	""	"type"	"Het type van afsluiting."	""	""	"true"	"https://wegenenverkeer.data.vlaanderen.be/ns/onderdeel#"	"Afsluiting.type"	"http://www.w3.org/2002/07/owl#ObjectProperty"	"https://wegenenverkeer.data.vlaanderen.be/ns/onderdeel#Afsluiting"	"http://www.w3.org/2004/02/skos/core#Concept"	""	"1"	"1"
"attribute"	"OSLO-Onderdeel"	"merk"	"{2B35DED3-7306-42bc-A6FD-C02628F23B58}"	""	"Afsluiting"	"{9C52C045-C441-4ad3-A5BD-C082E3A92A50}"	"KlAfsluitingMerk"	"merk"	"Het merk van de afsluiting."	""	"merk"	"Het merk van de afsluiting."	""	""	"true"	"https://wegenenverkeer.data.vlaanderen.be/ns/onderdeel#"	"Afsluiting.merk"	"http://www.w3.org/2002/07/owl#ObjectProperty"	"https://wegenenverkeer.data.vlaanderen.be/ns/onderdeel#Afsluiting"	"http://www.w3.org/2004/02/skos/core#Concept"	""	"1"	"1"
"attribute"	"OSLO-Onderdeel"	"modelnaam"	"{1E8CB6BC-D9B0-4cfa-98DA-78B70436780A}"	""	"Afsluiting"	"{9C52C045-C441-4ad3-A5BD-C082E3A92A50}"	"KlAfsluitingModelnaam"	"modelnaam"	"De modelnaam van de afsluiting."	""	"modelnaam"	"De modelnaam van de afsluiting."	""	""	"true"	"https://wegenenverkeer.data.vlaanderen.be/ns/onderdeel#"	"Afsluiting.modelnaam"	"http://www.w3.org/2002/07/owl#ObjectProperty"	"https://wegenenverkeer.data.vlaanderen.be/ns/onderdeel#Afsluiting"	"http://www.w3.org/2004/02/skos/core#Concept"	""	"1"	"1"
"attribute"	"OSLO-Onderdeel"	"technischeFiche"	"{D3E11F17-2895-4560-A689-031DE0A2FF05}"	""	"Afsluiting"	"{9C52C045-C441-4ad3-A5BD-C082E3A92A50}"	"DtcDocument"	"technische fiche"	"De technische fiche van de afsluiting."	""	"technische fiche"	"De technische fiche van de afsluiting."	""	""	"true"	"https://wegenenverkeer.data.vlaanderen.be/ns/onderdeel#"	"Afsluiting.technischeFiche"	"http://www.w3.org/2002/07/owl#ObjectProperty"	"https://wegenenverkeer.data.vlaanderen.be/ns/onderdeel#Afsluiting"	"https://wegenenverkeer.data.vlaanderen.be/ns/implementatieelement#DtcDocument"	""	"1"	"1"
"attribute"	"OSLO-Onderdeel"	"materiaal"	"{6D3F8E35-DB7D-42a0-912D-E46372F92C2C}"	""	"Afsluiting"	"{9C52C045-C441-4ad3-A5BD-C082E3A92A50}"	"KlAfsluitingMateriaal"	"materiaal"	"Het materiaal waaruit de afsluiting vervaardigd is."	""	"materiaal"	"Het materiaal waaruit de afsluiting vervaardigd is."	""	""	"true"	"https://wegenenverkeer.data.vlaanderen.be/ns/onderdeel#"	"Afsluiting.materiaal"	"http://www.w3.org/2002/07/owl#ObjectProperty"	"https://wegenenverkeer.data.vlaanderen.be/ns/onderdeel#Afsluiting"	"http://www.w3.org/2004/02/skos/core#Concept"	""	"1"	"1"
"attribute"	"OSLO-Onderdeel"	"hoogte"	"{0806782D-4D9C-4088-9037-198FDD1042F8}"	""	"Afsluiting"	"{9C52C045-C441-4ad3-A5BD-C082E3A92A50}"	"KwantWrdInCentimeter"	"hoogte"	"De hoogte in centimeter van de afsluiting."	""	"hoogte"	"De hoogte in centimeter van de afsluiting."	""	""	"true"	"https://wegenenverkeer.data.vlaanderen.be/ns/onderdeel#"	"Afsluiting.hoogte"	"http://www.w3.org/2002/07/owl#ObjectProperty"	"https://wegenenverkeer.data.vlaanderen.be/ns/onderdeel#Afsluiting"	"https://wegenenverkeer.data.vlaanderen.be/ns/implementatieelement#KwantWrdInCentimeter"	""	"1"	"1"
"attribute"	"OSLO-Abstracten"	"systeemvermogen"	"{6AFA45FB-C3AB-4cf6-8337-62A4E79C8070}"	""	"Verlichtingstoestel"	"{5A115294-9730-4015-AA66-C59F28983DC4}"	"KwantWrdInWatt"	"systeemvermogen"	"Systeemvermogen (Watt) van het verlichtingstoestel."	""	"systeemvermogen"	"Systeemvermogen (Watt) van het verlichtingstoestel."	""	""	"true"	"https://wegenenverkeer.data.vlaanderen.be/ns/abstracten#"	"Verlichtingstoestel.systeemvermogen"	"http://www.w3.org/2002/07/owl#ObjectProperty"	"https://wegenenverkeer.data.vlaanderen.be/ns/abstracten#Verlichtingstoestel"	"https://wegenenverkeer.data.vlaanderen.be/ns/implementatieelement#KwantWrdInWatt"	""	"1"	"1"
"attribute"	"OSLO-Abstracten"	"heeftAansluitkastGeintegreerd"	"{DE38ABFB-A012-4ff2-B1DE-2B6B089CB26A}"	""	"Verlichtingstoestel"	"{5A115294-9730-4015-AA66-C59F28983DC4}"	"Boolean"	"heeft aansluitkast geïntegreerd"	"Is de aansluitkast geïntegreerd?"	""	"heeft aansluitkast geïntegreerd"	"Is de aansluitkast geïntegreerd?"	""	""	"true"	"https://wegenenverkeer.data.vlaanderen.be/ns/abstracten#"	"Verlichtingstoestel.heeftAansluitkastGeintegreerd"	"http://www.w3.org/2002/07/owl#DatatypeProperty"	"https://wegenenverkeer.data.vlaanderen.be/ns/abstracten#Verlichtingstoestel"	"http://www.w3.org/2001/XMLSchema#boolean"	""	"1"	"1"
"attribute"	"OSLO-Abstracten"	"stroomkringnummer"	"{201096A7-1938-47ec-9D4E-1CACB33493EE}"	""	"Verlichtingstoestel"	"{5A115294-9730-4015-AA66-C59F28983DC4}"	"String"	"stroomkringnummer"	"Nummer van de stroomkring waarop het verlichtingstoestel is aangesloten."	""	"stroomkringnummer"	"Nummer van de stroomkring waarop het verlichtingstoestel is aangesloten."	""	""	"true"	"https://wegenenverkeer.data.vlaanderen.be/ns/abstracten#"	"Verlichtingstoestel.stroomkringnummer"	"http://www.w3.org/2002/07/owl#DatatypeProperty"	"https://wegenenverkeer.data.vlaanderen.be/ns/abstracten#Verlichtingstoestel"	"http://www.w3.org/2001/XMLSchema#string"	""	"1"	"1"
"attribute"	"OSLO-Abstracten"	"merk"	"{EFE90F14-2C11-4018-B38B-16E34F2C6FC2}"	""	"Verlichtingstoestel"	"{5A115294-9730-4015-AA66-C59F28983DC4}"	"KlVerlichtingstoestelMerk"	"merk"	"Het merk van het verlichtingstoestel."	""	"merk"	"Het merk van het verlichtingstoestel."	""	""	"true"	"https://wegenenverkeer.data.vlaanderen.be/ns/abstracten#"	"Verlichtingstoestel.merk"	"http://www.w3.org/2002/07/owl#ObjectProperty"	"https://wegenenverkeer.data.vlaanderen.be/ns/abstracten#Verlichtingstoestel"	"http://www.w3.org/2004/02/skos/core#Concept"	""	"1"	"1"
"attribute"	"OSLO-Abstracten"	"modelnaam"	"{B1BB25EC-3F6A-46b8-8D48-06F04392F347}"	""	"Verlichtingstoestel"	"{5A115294-9730-4015-AA66-C59F28983DC4}"	"KlVerlichtingstoestelModelnaam"	"modelnaam"	"De modelnaam van het verlichtingstoestel."	""	"modelnaam"	"De modelnaam van het verlichtingstoestel."	""	""	"true"	"https://wegenenverkeer.data.vlaanderen.be/ns/abstracten#"	"Verlichtingstoestel.modelnaam"	"http://www.w3.org/2002/07/owl#ObjectProperty"	"https://wegenenverkeer.data.vlaanderen.be/ns/abstracten#Verlichtingstoestel"	"http://www.w3.org/2004/02/skos/core#Concept"	""	"1"	"1"
"attribute"	"OSLO-Abstracten"	"verlichtGebied"	"{5160A077-87D1-4c48-A250-7F231E5E905F}"	""	"Verlichtingstoestel"	"{5A115294-9730-4015-AA66-C59F28983DC4}"	"KlVerlichtingstoestelVerlichtGebied"	"verlicht gebied"	"Het gebied op de wegbaan of het object dat verlicht wordt door het verlichtingstoestel."	""	"verlicht gebied"	"Het gebied op de wegbaan of het object dat verlicht wordt door het verlichtingstoestel."	""	""	"true"	"https://wegenenverkeer.data.vlaanderen.be/ns/abstracten#"	"Verlichtingstoestel.verlichtGebied"	"http://www.w3.org/2002/07/owl#ObjectProperty"	"https://wegenenverkeer.data.vlaanderen.be/ns/abstracten#Verlichtingstoestel"	"http://www.w3.org/2004/02/skos/core#Concept"	""	"1"	"1"
"attribute"	"OSLO-Onderdeel"	"type"	"{D8C1E59A-3D23-40c3-8A6A-621467CF5917}"	""	"Bevestigingsbeugel"	"{CF892540-6A41-4e1c-975C-5290D598A551}"	"KlBevestigingsbeugelType"	"type"	"Het type van de bevestigingsbeugel."	""	"type"	"Het type van de bevestigingsbeugel."	""	""	"true"	"https://wegenenverkeer.data.vlaanderen.be/ns/onderdeel#"	"Bevestigingsbeugel.type"	"http://www.w3.org/2002/07/owl#ObjectProperty"	"https://wegenenverkeer.data.vlaanderen.be/ns/onderdeel#Bevestigingsbeugel"	"http://www.w3.org/2004/02/skos/core#Concept"	""	"1"	"1"
"attribute"	"OSLO-Onderdeel"	"berekeningsnota"	"{91A9F0F5-880B-4c6e-B7C4-8124C0064166}"	""	"Bevestigingsbeugel"	"{CF892540-6A41-4e1c-975C-5290D598A551}"	"DtcDocument"	"berekeningsnota"	"Document met de berekeningsnota van de bevestigingsbeugel."	"Bestanden van het type xlsx of pdf."	"berekeningsnota"	"Document met de berekeningsnota van de bevestigingsbeugel."	""	""	"true"	"https://wegenenverkeer.data.vlaanderen.be/ns/onderdeel#"	"Bevestigingsbeugel.berekeningsnota"	"http://www.w3.org/2002/07/owl#ObjectProperty"	"https://wegenenverkeer.data.vlaanderen.be/ns/onderdeel#Bevestigingsbeugel"	"https://wegenenverkeer.data.vlaanderen.be/ns/implementatieelement#DtcDocument"	""	"1"	"*"
"attribute"	"OSLO-Onderdeel"	"constructieEnMontageplan"	"{1B6C17BB-97F6-4687-8578-C73BA651E1B6}"	""	"Bevestigingsbeugel"	"{CF892540-6A41-4e1c-975C-5290D598A551}"	"DtcDocument"	"constructie en montageplan"	"Document met het constructie- en montageplan van de bevestigingsbeugel."	"Bestanden van het type dwg of pdf."	"constructie en montageplan"	"Document met het constructie- en montageplan van de bevestigingsbeugel."	""	""	"true"	"https://wegenenverkeer.data.vlaanderen.be/ns/onderdeel#"	"Bevestigingsbeugel.constructieEnMontageplan"	"http://www.w3.org/2002/07/owl#ObjectProperty"	"https://wegenenverkeer.data.vlaanderen.be/ns/onderdeel#Bevestigingsbeugel"	"https://wegenenverkeer.data.vlaanderen.be/ns/implementatieelement#DtcDocument"	""	"1"	"*"
"attribute"	"OSLO-Onderdeel"	"isVerzegeld"	"{EE37649F-DCA0-4328-82F1-29991E62206F}"	""	"Bevestigingsbeugel"	"{CF892540-6A41-4e1c-975C-5290D598A551}"	"Boolean"	"is verzegeld"	"Geeft aan of de bevestigingsbeugel verzegeld is tegen het ongemerkt losmaken ervan."	""	"is verzegeld"	"Geeft aan of de bevestigingsbeugel verzegeld is tegen het ongemerkt losmaken ervan."	""	""	"true"	"https://wegenenverkeer.data.vlaanderen.be/ns/onderdeel#"	"Bevestigingsbeugel.isVerzegeld"	"http://www.w3.org/2002/07/owl#DatatypeProperty"	"https://wegenenverkeer.data.vlaanderen.be/ns/onderdeel#Bevestigingsbeugel"	"http://www.w3.org/2001/XMLSchema#boolean"	""	"1"	"1"
"attribute"	"OSLO-Onderdeel"	"heeftVeiligheidsstrip"	"{ED3477A0-E0EF-43e1-9C80-AD1DB09FE917}"	""	"Bevestigingsbeugel"	"{CF892540-6A41-4e1c-975C-5290D598A551}"	"Boolean"	"heeft veiligheidsstrip"	"Metalen strip in de beugel, die verhinderd dat het bevestigd onderdeel naar beneden zou komen (bijvoorbeeld bij brand)."	""	"heeft veiligheidsstrip"	"Metalen strip in de beugel, die verhinderd dat het bevestigd onderdeel naar beneden zou komen (bijvoorbeeld bij brand)."	""	""	"true"	"https://wegenenverkeer.data.vlaanderen.be/ns/onderdeel#"	"Bevestigingsbeugel.heeftVeiligheidsstrip"	"http://www.w3.org/2002/07/owl#DatatypeProperty"	"https://wegenenverkeer.data.vlaanderen.be/ns/onderdeel#Bevestigingsbeugel"	"http://www.w3.org/2001/XMLSchema#boolean"	""	"1"	"1"
"attribute"	"OSLO-Onderdeel"	"ipAdres"	"{E836E0A5-9BDE-4042-A66B-5A8254539FBB}"	""	"IntercomToestel"	"{22528038-0DFE-4cdf-AC3B-F5FFCF98B9BB}"	"DteIPv4Adres"	"IP-adres"	"Het IP-adres van het intercomtoestel."	""	"IP-adres"	"Het IP-adres van het intercomtoestel."	""	""	"true"	"https://wegenenverkeer.data.vlaanderen.be/ns/onderdeel#"	"IntercomToestel.ipAdres"	"http://www.w3.org/2002/07/owl#ObjectProperty"	"https://wegenenverkeer.data.vlaanderen.be/ns/onderdeel#IntercomToestel"	"https://wegenenverkeer.data.vlaanderen.be/ns/implementatieelement#DteIPv4Adres"	""	"1"	"1"
"attribute"	"OSLO-Onderdeel"	"transportType"	"{A4E3580E-C2B3-4dc9-8EB0-B309AD3825AD}"	""	"IntercomToestel"	"{22528038-0DFE-4cdf-AC3B-F5FFCF98B9BB}"	"KlAudioTransportType"	"transporttype"	"Geeft het type van (video- en) audiotransport aan van het intercomtoestel binnen het intercomsysteem."	""	"transporttype"	"Geeft het type van (video- en) audiotransport aan van het intercomtoestel binnen het intercomsysteem."	""	""	"true"	"https://wegenenverkeer.data.vlaanderen.be/ns/onderdeel#"	"IntercomToestel.transportType"	"http://www.w3.org/2002/07/owl#ObjectProperty"	"https://wegenenverkeer.data.vlaanderen.be/ns/onderdeel#IntercomToestel"	"http://www.w3.org/2004/02/skos/core#Concept"	""	"1"	"1"
"attribute"	"OSLO-Onderdeel"	"technischeFiche"	"{4C74D429-04F7-4712-AFAC-FD25C17AF99E}"	""	"IntercomToestel"	"{22528038-0DFE-4cdf-AC3B-F5FFCF98B9BB}"	"DtcDocument"	"technische fiche"	"De technische fiche van het intercomtoestel."	""	"technische fiche"	"De technische fiche van het intercomtoestel."	""	""	"true"	"https://wegenenverkeer.data.vlaanderen.be/ns/onderdeel#"	"IntercomToestel.technischeFiche"	"http://www.w3.org/2002/07/owl#ObjectProperty"	"https://wegenenverkeer.data.vlaanderen.be/ns/onderdeel#IntercomToestel"	"https://wegenenverkeer.data.vlaanderen.be/ns/implementatieelement#DtcDocument"	""	"1"	"1"
"attribute"	"OSLO-Onderdeel"	"merk"	"{B885E61B-8326-4b8e-817A-D5418C84AC13}"	""	"IntercomToestel"	"{22528038-0DFE-4cdf-AC3B-F5FFCF98B9BB}"	"KlIntercomMerk"	"merk"	"Het merk van het intercomtoestel."	""	"merk"	"Het merk van het intercomtoestel."	""	""	"true"	"https://wegenenverkeer.data.vlaanderen.be/ns/onderdeel#"	"IntercomToestel.merk"	"http://www.w3.org/2002/07/owl#ObjectProperty"	"https://wegenenverkeer.data.vlaanderen.be/ns/onderdeel#IntercomToestel"	"http://www.w3.org/2004/02/skos/core#Concept"	""	"1"	"1"
"attribute"	"OSLO-Onderdeel"	"modelnaam"	"{D3CEC51E-8170-4f49-A086-40EBE723FE87}"	""	"IntercomToestel"	"{22528038-0DFE-4cdf-AC3B-F5FFCF98B9BB}"	"KlIntercomModelnaam"	"modelnaam"	"De modelnaam van het intercomtoestel."	""	"modelnaam"	"De modelnaam van het intercomtoestel."	""	""	"true"	"https://wegenenverkeer.data.vlaanderen.be/ns/onderdeel#"	"IntercomToestel.modelnaam"	"http://www.w3.org/2002/07/owl#ObjectProperty"	"https://wegenenverkeer.data.vlaanderen.be/ns/onderdeel#IntercomToestel"	"http://www.w3.org/2004/02/skos/core#Concept"	""	"1"	"1"
"attribute"	"OSLO-Onderdeel"	"heeftVideo"	"{2E4E27C0-8671-4d32-82AD-E34AE985C453}"	""	"IntercomToestel"	"{22528038-0DFE-4cdf-AC3B-F5FFCF98B9BB}"	"Boolean"	"heeft video"	"Geeft aan of communicatie tussen personen al dan niet via video kan verlopen."	""	"heeft video"	"Geeft aan of communicatie tussen personen al dan niet via video kan verlopen."	""	""	"true"	"https://wegenenverkeer.data.vlaanderen.be/ns/onderdeel#"	"IntercomToestel.heeftVideo"	"http://www.w3.org/2002/07/owl#DatatypeProperty"	"https://wegenenverkeer.data.vlaanderen.be/ns/onderdeel#IntercomToestel"	"http://www.w3.org/2001/XMLSchema#boolean"	""	"1"	"1"
"attribute"	"OSLO-Onderdeel"	"dnsNaam"	"{C215316C-A6C8-4ea6-A935-A9A498C9093D}"	""	"IntercomToestel"	"{22528038-0DFE-4cdf-AC3B-F5FFCF98B9BB}"	"String"	"DNS naam"	"De DNSNaam (ook ""volledige domein naam"" genoemd ) is een unieke naam binnen het Domain Name System (DNS), het naamgevingssysteem waarmee computers, webservers, diensten en toepassing op een unieke manier kunnen worden geïdentificeerd. Deze bevat zowel de hostname en de top level domein naam bv. 120c8-ar1.belfa.be."	""	"DNS naam"	"De DNSNaam (ook ""volledige domein naam"" genoemd ) is een unieke naam binnen het Domain Name System (DNS), het naamgevingssysteem waarmee computers, webservers, diensten en toepassing op een unieke manier kunnen worden geïdentificeerd. Deze bevat zowel de hostname en de top level domein naam bv. 120c8-ar1.belfa.be."	""	""	"true"	"https://wegenenverkeer.data.vlaanderen.be/ns/onderdeel#"	"IntercomToestel.dnsNaam"	"http://www.w3.org/2002/07/owl#DatatypeProperty"	"https://wegenenverkeer.data.vlaanderen.be/ns/onderdeel#IntercomToestel"	"http://www.w3.org/2001/XMLSchema#string"	""	"1"	"1"
"attribute"	"OSLO-Onderdeel"	"oproepnummer"	"{6E44AFB9-8511-4f9e-809B-64C8B9EFC6BF}"	""	"IntercomToestel"	"{22528038-0DFE-4cdf-AC3B-F5FFCF98B9BB}"	"String"	"oproepnummer"	"Het nummer dat een gebruiker in een verzendend toestel ingeeft om een verbinding te maken met dit, het ontvangend, toestel."	""	"oproepnummer"	"Het nummer dat een gebruiker in een verzendend toestel ingeeft om een verbinding te maken met dit, het ontvangend, toestel."	""	""	"true"	"https://wegenenverkeer.data.vlaanderen.be/ns/onderdeel#"	"IntercomToestel.oproepnummer"	"http://www.w3.org/2002/07/owl#DatatypeProperty"	"https://wegenenverkeer.data.vlaanderen.be/ns/onderdeel#IntercomToestel"	"http://www.w3.org/2001/XMLSchema#string"	""	"1"	"1"
"attribute"	"OSLO-Onderdeel"	"heeftCamera"	"{9E0106E5-ADA5-406d-978F-2A3B335CBF03}"	""	"IntercomToestel"	"{22528038-0DFE-4cdf-AC3B-F5FFCF98B9BB}"	"Boolean"	"heeft camera"	"Geeft aan of het toestel voorzien is van een camera om naast audio ook video ter verzenden naar een ander toestel in het netwerk."	""	"heeft camera"	"Geeft aan of het toestel voorzien is van een camera om naast audio ook video ter verzenden naar een ander toestel in het netwerk."	""	""	"true"	"https://wegenenverkeer.data.vlaanderen.be/ns/onderdeel#"	"IntercomToestel.heeftCamera"	"http://www.w3.org/2002/07/owl#DatatypeProperty"	"https://wegenenverkeer.data.vlaanderen.be/ns/onderdeel#IntercomToestel"	"http://www.w3.org/2001/XMLSchema#boolean"	""	"1"	"1"
"attribute"	"OSLO-Onderdeel"	"isInbouw"	"{B868231F-3AAF-4c48-BD1E-EE5A95435EA1}"	""	"IntercomToestel"	"{22528038-0DFE-4cdf-AC3B-F5FFCF98B9BB}"	"Boolean"	"is inbouw"	"Geeft aan of het intercomtoestel een inbouw- of opbouwtoestel is."	""	"is inbouw"	"Geeft aan of het intercomtoestel een inbouw- of opbouwtoestel is."	""	""	"true"	"https://wegenenverkeer.data.vlaanderen.be/ns/onderdeel#"	"IntercomToestel.isInbouw"	"http://www.w3.org/2002/07/owl#DatatypeProperty"	"https://wegenenverkeer.data.vlaanderen.be/ns/onderdeel#IntercomToestel"	"http://www.w3.org/2001/XMLSchema#boolean"	""	"1"	"1"
"attribute"	"OSLO-Onderdeel"	"uitvoering"	"{FE52052E-207B-4f03-B9A1-1520D292DA41}"	""	"IntercomToestel"	"{22528038-0DFE-4cdf-AC3B-F5FFCF98B9BB}"	"KlIntercomUitvoering"	"uitvoering"	"Geeft aan welke functie het toestel vervultin het intercomnetwerk."	""	"uitvoering"	"Geeft aan welke functie het toestel vervultin het intercomnetwerk."	""	""	"true"	"https://wegenenverkeer.data.vlaanderen.be/ns/onderdeel#"	"IntercomToestel.uitvoering"	"http://www.w3.org/2002/07/owl#ObjectProperty"	"https://wegenenverkeer.data.vlaanderen.be/ns/onderdeel#IntercomToestel"	"http://www.w3.org/2004/02/skos/core#Concept"	""	"1"	"1"
"attribute"	"OSLO-Onderdeel"	"transportType"	"{5B32B936-FE81-4d00-BACA-019C4DCF9564}"	""	"Luidspreker"	"{9DEDB15B-BD6A-478d-BB6D-388D7F2AB5C1}"	"KlAudioTransportType"	"transport type"	"Geeft aan op welke manier het audiosignaal wordt getransporteerd door het toestel."	""	"transport type"	"Geeft aan op welke manier het audiosignaal wordt getransporteerd door het toestel."	""	""	"true"	"https://wegenenverkeer.data.vlaanderen.be/ns/onderdeel#"	"Luidspreker.transportType"	"http://www.w3.org/2002/07/owl#ObjectProperty"	"https://wegenenverkeer.data.vlaanderen.be/ns/onderdeel#Luidspreker"	"http://www.w3.org/2004/02/skos/core#Concept"	""	"1"	"1"
"attribute"	"OSLO-Onderdeel"	"technischeFiche"	"{52E7A20C-F76A-4821-835D-9E04B780CD27}"	""	"Luidspreker"	"{9DEDB15B-BD6A-478d-BB6D-388D7F2AB5C1}"	"DtcDocument"	"technische fiche"	"De technische fiche van de luidspreker."	""	"technische fiche"	"De technische fiche van de luidspreker."	""	""	"true"	"https://wegenenverkeer.data.vlaanderen.be/ns/onderdeel#"	"Luidspreker.technischeFiche"	"http://www.w3.org/2002/07/owl#ObjectProperty"	"https://wegenenverkeer.data.vlaanderen.be/ns/onderdeel#Luidspreker"	"https://wegenenverkeer.data.vlaanderen.be/ns/implementatieelement#DtcDocument"	""	"1"	"1"
"attribute"	"OSLO-Onderdeel"	"merk"	"{307348BB-D670-4232-8976-54D5F0BE7544}"	""	"Luidspreker"	"{9DEDB15B-BD6A-478d-BB6D-388D7F2AB5C1}"	"KlLuidsprekerMerk"	"merk"	"Het merk van de luidspreker."	""	"merk"	"Het merk van de luidspreker."	""	""	"true"	"https://wegenenverkeer.data.vlaanderen.be/ns/onderdeel#"	"Luidspreker.merk"	"http://www.w3.org/2002/07/owl#ObjectProperty"	"https://wegenenverkeer.data.vlaanderen.be/ns/onderdeel#Luidspreker"	"http://www.w3.org/2004/02/skos/core#Concept"	""	"1"	"1"
"attribute"	"OSLO-Onderdeel"	"modelnaam"	"{22BB427C-7838-4bec-BB51-24D9A25B61F9}"	""	"Luidspreker"	"{9DEDB15B-BD6A-478d-BB6D-388D7F2AB5C1}"	"KlLuidsprekerModelnaam"	"modelnaam"	"De modelnaam van de luidspreker."	""	"modelnaam"	"De modelnaam van de luidspreker."	""	""	"true"	"https://wegenenverkeer.data.vlaanderen.be/ns/onderdeel#"	"Luidspreker.modelnaam"	"http://www.w3.org/2002/07/owl#ObjectProperty"	"https://wegenenverkeer.data.vlaanderen.be/ns/onderdeel#Luidspreker"	"http://www.w3.org/2004/02/skos/core#Concept"	""	"1"	"1"
"attribute"	"OSLO-Onderdeel"	"vormgeving"	"{3AA0B4FC-6E4A-4428-B7D6-F083ADCBC12F}"	""	"Luidspreker"	"{9DEDB15B-BD6A-478d-BB6D-388D7F2AB5C1}"	"KLLuidsprekerVormgeving"	"vormgeving"	"Soort luidsprekers volgens zijn vormfactor."	""	"vormgeving"	"Soort luidsprekers volgens zijn vormfactor."	""	""	"true"	"https://wegenenverkeer.data.vlaanderen.be/ns/onderdeel#"	"Luidspreker.vormgeving"	"http://www.w3.org/2002/07/owl#ObjectProperty"	"https://wegenenverkeer.data.vlaanderen.be/ns/onderdeel#Luidspreker"	"http://www.w3.org/2004/02/skos/core#Concept"	""	"1"	"1"
"attribute"	"OSLO-Onderdeel"	"ipAdres"	"{909B4C75-E725-43c2-B305-A707B0907843}"	""	"Camera"	"{DA10504C-AFBE-42f6-857E-D494CFDB95A4}"	"DteIPv4Adres"	"ip adres"	"Het IP-adres van de camera."	""	"ip adres"	"Het IP-adres van de camera."	""	""	"true"	"https://wegenenverkeer.data.vlaanderen.be/ns/onderdeel#"	"Camera.ipAdres"	"http://www.w3.org/2002/07/owl#ObjectProperty"	"https://wegenenverkeer.data.vlaanderen.be/ns/onderdeel#Camera"	"https://wegenenverkeer.data.vlaanderen.be/ns/implementatieelement#DteIPv4Adres"	""	"1"	"1"
"attribute"	"OSLO-Onderdeel"	"technischeFiche"	"{1C8362D2-B903-432b-AC8B-48DAD3DF5E73}"	""	"Camera"	"{DA10504C-AFBE-42f6-857E-D494CFDB95A4}"	"DtcDocument"	"technische fiche"	"Technische fiche van dit element met opsplitsing tussen CCTV, AID en PTZ-camera's."	"Bestanden van het type pdf."	"technische fiche"	"Technische fiche van dit element met opsplitsing tussen CCTV, AID en PTZ-camera's."	""	""	"true"	"https://wegenenverkeer.data.vlaanderen.be/ns/onderdeel#"	"Camera.technischeFiche"	"http://www.w3.org/2002/07/owl#ObjectProperty"	"https://wegenenverkeer.data.vlaanderen.be/ns/onderdeel#Camera"	"https://wegenenverkeer.data.vlaanderen.be/ns/implementatieelement#DtcDocument"	""	"1"	"1"
"attribute"	"OSLO-Onderdeel"	"modelnaam"	"{01C64D0F-1586-4af8-BE00-08E4DCFBF706}"	""	"Camera"	"{DA10504C-AFBE-42f6-857E-D494CFDB95A4}"	"KlCameraModelnaam"	"modelnaam"	"De modelnaam van de camera."	""	"modelnaam"	"De modelnaam van de camera."	""	""	"true"	"https://wegenenverkeer.data.vlaanderen.be/ns/onderdeel#"	"Camera.modelnaam"	"http://www.w3.org/2002/07/owl#ObjectProperty"	"https://wegenenverkeer.data.vlaanderen.be/ns/onderdeel#Camera"	"http://www.w3.org/2004/02/skos/core#Concept"	""	"1"	"1"
"attribute"	"OSLO-Onderdeel"	"heeftSpitsstrook"	"{54F4A7A0-7C1F-4d13-9F56-9AF11A3F511A}"	""	"Camera"	"{DA10504C-AFBE-42f6-857E-D494CFDB95A4}"	"Boolean"	"heeft spitsstrook"	"Locatie-eigenschap van een camera. Dit attribuut geeft aan of de camera ingezet wordt om een spitsstrook te schouwen."	"Attribuut uit gebruik sinds versie 2.3.0 "	"heeft spitsstrook"	"Locatie-eigenschap van een camera. Dit attribuut geeft aan of de camera ingezet wordt om een spitsstrook te schouwen."	""	""	"true"	"https://wegenenverkeer.data.vlaanderen.be/ns/onderdeel#"	"Camera.heeftSpitsstrook"	"http://www.w3.org/2002/07/owl#DatatypeProperty"	"https://wegenenverkeer.data.vlaanderen.be/ns/onderdeel#Camera"	"http://www.w3.org/2001/XMLSchema#boolean"	""	"1"	"1"
"attribute"	"OSLO-Onderdeel"	"isPtz"	"{CF0901A7-24F8-4d02-B2E7-58A1F12B12B8}"	""	"Camera"	"{DA10504C-AFBE-42f6-857E-D494CFDB95A4}"	"Boolean"	"is PTZ"	"Een PTZ-camera is een CCTV-camera met bijhorend de mogelijkheid om te pannen, tilten en zoomen. Dit vanop afstand met behulp van een verstelbare lens en een motor die in twee assen draaibeweging toelaat."	""	"is PTZ"	"Een PTZ-camera is een CCTV-camera met bijhorend de mogelijkheid om te pannen, tilten en zoomen. Dit vanop afstand met behulp van een verstelbare lens en een motor die in twee assen draaibeweging toelaat."	""	""	"true"	"https://wegenenverkeer.data.vlaanderen.be/ns/onderdeel#"	"Camera.isPtz"	"http://www.w3.org/2002/07/owl#DatatypeProperty"	"https://wegenenverkeer.data.vlaanderen.be/ns/onderdeel#Camera"	"http://www.w3.org/2001/XMLSchema#boolean"	""	"1"	"1"
"attribute"	"OSLO-Onderdeel"	"heeftAid"	"{BF45B238-3E1D-47ae-9D98-A300840AAB91}"	""	"Camera"	"{DA10504C-AFBE-42f6-857E-D494CFDB95A4}"	"Boolean"	"heeft AID"	"Een AID-camera is een CCTV-camera met geintegreerde AID-module. Deze camera genereert naast een camerabeeld ook metadata ivm wat zich afspeelt op het beeld. Een voorbeeld hiervan is gestopte voertuigen."	"Attribuut uit gebruik sinds versie 2.3.0 "	"heeft AID"	"Een AID-camera is een CCTV-camera met geintegreerde AID-module. Deze camera genereert naast een camerabeeld ook metadata ivm wat zich afspeelt op het beeld. Een voorbeeld hiervan is gestopte voertuigen."	""	""	"true"	"https://wegenenverkeer.data.vlaanderen.be/ns/onderdeel#"	"Camera.heeftAid"	"http://www.w3.org/2002/07/owl#DatatypeProperty"	"https://wegenenverkeer.data.vlaanderen.be/ns/onderdeel#Camera"	"http://www.w3.org/2001/XMLSchema#boolean"	""	"1"	"1"
"attribute"	"OSLO-Onderdeel"	"merk"	"{3C5078A5-30E9-431d-9FA6-5175ADFD6DDE}"	""	"Camera"	"{DA10504C-AFBE-42f6-857E-D494CFDB95A4}"	"KlCameraMerk"	"merk"	"Het merk van de camera."	""	"merk"	"Het merk van de camera."	""	""	"true"	"https://wegenenverkeer.data.vlaanderen.be/ns/onderdeel#"	"Camera.merk"	"http://www.w3.org/2002/07/owl#ObjectProperty"	"https://wegenenverkeer.data.vlaanderen.be/ns/onderdeel#Camera"	"http://www.w3.org/2004/02/skos/core#Concept"	""	"1"	"1"
