"EA-Type"	"EA-Package"	"EA-Name"	"EA-GUID"	"EA-Parent"	"EA-Domain"	"EA-Domain-GUID"	"EA-Range"	"label"	"definition"	"usage"	"ap-label-nl"	"ap-definition-nl"	"ap-usageNote-nl"	"ap-codelist"	"external term"	"namespace"	"localname"	"type"	"domain"	"range"	"parent"	"min card"	"max card"
"Package"	""	"OSLO-Zoutbijlaadplaats"	"{2B13B3EA-0869-40b9-842C-E1548C90F0D9}"	""	""	""	""	""	""	""	""	""	""	""	""	"http://"	"fixme.com"	"http://www.w3.org/2002/07/owl#Ontology"	""	""	""	""	""
"CLASS"	"OSLO-Onderdeel"	"Netwerkpoort"	"{2E04F022-D23F-4f64-B2B5-E78D3044EDAE}"	""	""	""	""	"Netwerkpoort"	"De ingang van het toestel samen met component die erop zit,bv. SFP of XFP."	""	"Netwerkpoort"	"De ingang van het toestel samen met component die erop zit,bv. SFP of XFP."	""	""	"true"	"https://wegenenverkeer.data.vlaanderen.be/ns/onderdeel#"	"Netwerkpoort"	"http://www.w3.org/2000/01/rdf-schema#Class"	""	""	"https://wegenenverkeer.data.vlaanderen.be/ns/implementatieelement#AIMNaamObject"	""	""
"CLASS"	"OSLO-Onderdeel"	"Lockermanagementmodule"	"{EBFC513B-7CA1-4b26-B1D7-DC1EF0156CDC}"	""	""	""	""	"Lockermanagementmodule"	"Inrichting voor het beheer van lockerkasten."	""	"Lockermanagementmodule"	"Inrichting voor het beheer van lockerkasten."	""	""	"true"	"https://wegenenverkeer.data.vlaanderen.be/ns/onderdeel#"	"Lockermanagementmodule"	"http://www.w3.org/2000/01/rdf-schema#Class"	""	""	"https://wegenenverkeer.data.vlaanderen.be/ns/implementatieelement#AIMNaamObject"	""	""
"CLASS"	"OSLO-Onderdeel"	"Pomp"	"{7808769D-821E-4d67-AEEA-DDCA86EB8048}"	""	""	""	""	"Pomp"	"Een pomp is een werktuig dat water verplaatst door er energie aan af te geven in de vorm van een drukverhoging of snelheidsverhoging."	""	"Pomp"	"Een pomp is een werktuig dat water verplaatst door er energie aan af te geven in de vorm van een drukverhoging of snelheidsverhoging."	""	""	"true"	"https://wegenenverkeer.data.vlaanderen.be/ns/onderdeel#"	"Pomp"	"http://www.w3.org/2000/01/rdf-schema#Class"	""	""	"https://wegenenverkeer.data.vlaanderen.be/ns/abstracten#LinkendElement"	""	""
"CLASS"	"OSLO-Onderdeel"	"Stuurklep"	"{336ABF25-9E55-472b-B64B-4A5DADC725C9}"	""	""	""	""	"Stuurklep"	"Een afsluiter die vanop afstand bediend wordt om te bepalen of er al of niet vloeistof of gas door de leiding stroomt."	""	"Stuurklep"	"Een afsluiter die vanop afstand bediend wordt om te bepalen of er al of niet vloeistof of gas door de leiding stroomt."	""	""	"true"	"https://wegenenverkeer.data.vlaanderen.be/ns/onderdeel#"	"Stuurklep"	"http://www.w3.org/2000/01/rdf-schema#Class"	""	""	"https://wegenenverkeer.data.vlaanderen.be/ns/implementatieelement#AIMNaamObject"	""	""
"CLASS"	"OSLO-Onderdeel"	"Persleiding"	"{0EDDF127-D5D3-40b1-BFF8-F55788952B50}"	""	""	""	""	"Persleiding"	"Ondergronds kanaal of pijp voor afvoer van een vloeistof of gas onder druk."	""	"Persleiding"	"Ondergronds kanaal of pijp voor afvoer van een vloeistof of gas onder druk."	""	""	"true"	"https://wegenenverkeer.data.vlaanderen.be/ns/onderdeel#"	"Persleiding"	"http://www.w3.org/2000/01/rdf-schema#Class"	""	""	"https://wegenenverkeer.data.vlaanderen.be/ns/abstracten#Buis"	""	""
"CLASS"	"OSLO-Onderdeel"	"TrekdraadEncoderNiveaumeting"	"{9806F260-7C1D-4ff9-B007-8C3903F94A5A}"	"Niveaumeting"	""	""	""	"Trekdraad encoder niveaumeting"	"Een inrichting voor het bepalen van het peil van een vloeistof (bv het peil van een waterloop, uitgedrukt in meter TAW). Deze inrichting maakt gebruik van een combinatie van vlotter-kabel-encoder. Het resultaat wordt omgezet in een uitleesbaar signaal."	"Het betreft de hele inrichting, dus zowel de trekdraad encoder als de vlotter."	"Trekdraad encoder niveaumeting"	"Een inrichting voor het bepalen van het peil van een vloeistof (bv het peil van een waterloop, uitgedrukt in meter TAW). Deze inrichting maakt gebruik van een combinatie van vlotter-kabel-encoder. Het resultaat wordt omgezet in een uitleesbaar signaal."	""	""	"true"	"https://wegenenverkeer.data.vlaanderen.be/ns/onderdeel#"	"TrekdraadEncoderNiveaumeting"	"http://www.w3.org/2000/01/rdf-schema#Class"	""	""	"https://wegenenverkeer.data.vlaanderen.be/ns/abstracten#Niveaumeting"	""	""
"CLASS"	"OSLO-Onderdeel"	"UltrasoonNiveaumeting"	"{560F6EE9-86C4-4bf8-A681-8DD607B7504F}"	"Niveaumeting"	""	""	""	"Ultrasoon niveaumeting"	"Een inrichting voor het bepalen van het peil van een vloeistof (bv. het peil van een waterloop, uitgedrukt in meter TAW). De sensor meet het tijdsinterval tussen het uitzenden en ontvangen van geluidsgolven en bepaald hiermee de afstand (hoogte) tot een object (water). Het resultaat wordt omgezet in een uitleesbaar signaal.

"	""	"Ultrasoon niveaumeting"	"Een inrichting voor het bepalen van het peil van een vloeistof (bv. het peil van een waterloop, uitgedrukt in meter TAW). De sensor meet het tijdsinterval tussen het uitzenden en ontvangen van geluidsgolven en bepaald hiermee de afstand (hoogte) tot een object (water). Het resultaat wordt omgezet in een uitleesbaar signaal.

"	""	""	"true"	"https://wegenenverkeer.data.vlaanderen.be/ns/onderdeel#"	"UltrasoonNiveaumeting"	"http://www.w3.org/2000/01/rdf-schema#Class"	""	""	"https://wegenenverkeer.data.vlaanderen.be/ns/abstracten#Niveaumeting"	""	""
"CLASS"	"OSLO-Onderdeel"	"CapacitieveNiveaumeting"	"{CC2AA4DA-AB58-4de6-B5C9-643A5DF2BC1B}"	"Niveaumeting"	""	""	""	"Capacitieve niveaumeting"	"Een inrichting voor het bepalen van het peil van een vloeistof (bv. het waterniveau in een vloeistoftank of lekwaterput van een kelder). Een capacitieve sensor meet de aan- of afwezigheid van een materiaal of vloeistof. Het meest gebruikte type is de driepunts elektrode, hierbij krijgt elke elektrode een eigen grenswaarde, uit de combinatie van de gegeven die de  verschillende elektroden oplevert kan het niveau bepaald worden. Het resultaat wordt omgezet in een uitleesbaar signaal.
"	""	"Capacitieve niveaumeting"	"Een inrichting voor het bepalen van het peil van een vloeistof (bv. het waterniveau in een vloeistoftank of lekwaterput van een kelder). Een capacitieve sensor meet de aan- of afwezigheid van een materiaal of vloeistof. Het meest gebruikte type is de driepunts elektrode, hierbij krijgt elke elektrode een eigen grenswaarde, uit de combinatie van de gegeven die de  verschillende elektroden oplevert kan het niveau bepaald worden. Het resultaat wordt omgezet in een uitleesbaar signaal.
"	""	""	"true"	"https://wegenenverkeer.data.vlaanderen.be/ns/onderdeel#"	"CapacitieveNiveaumeting"	"http://www.w3.org/2000/01/rdf-schema#Class"	""	""	"https://wegenenverkeer.data.vlaanderen.be/ns/abstracten#Niveaumeting"	""	""
"CLASS"	"OSLO-Onderdeel"	"HydrostatischeNiveaumeting"	"{D277C54E-E877-4826-88EC-36401278B08A}"	"Niveaumeting"	""	""	""	"Hydrostatische niveaumeting"	"Een inrichting voor het bepalen van het peil van een vloeistof (bv. het waterniveau in een vloeistoftank of lekwaterput van een kelder). De sensor meet de hydrostatische druk (gewicht) van een vloeistof en bepaalt met deze gegevens het niveau van de vloeistof. Het resultaat wordt omgezet in een uitleesbaar signaal.
"	""	"Hydrostatische niveaumeting"	"Een inrichting voor het bepalen van het peil van een vloeistof (bv. het waterniveau in een vloeistoftank of lekwaterput van een kelder). De sensor meet de hydrostatische druk (gewicht) van een vloeistof en bepaalt met deze gegevens het niveau van de vloeistof. Het resultaat wordt omgezet in een uitleesbaar signaal.
"	""	""	"true"	"https://wegenenverkeer.data.vlaanderen.be/ns/onderdeel#"	"HydrostatischeNiveaumeting"	"http://www.w3.org/2000/01/rdf-schema#Class"	""	""	"https://wegenenverkeer.data.vlaanderen.be/ns/abstracten#Niveaumeting"	""	""
"CLASS"	"OSLO-Onderdeel"	"RadarNiveaumeting"	"{917E5E93-AAAA-4ece-B12F-422FA556567C}"	"Niveaumeting"	""	""	""	"Radarniveaumeting"	"Een inrichting voor het bepalen van het peil van een vloeistof (bv het peil van een waterloop, uitgedrukt in meter TAW). De radar meet het tijdsinterval tussen het uitzenden en ontvangen van radiogolven en bepaald hiermee de afstand (hoogte) tot een object (water). Het resultaat wordt omgezet in een uitleesbaar signaal.
"	""	"Radarniveaumeting"	"Een inrichting voor het bepalen van het peil van een vloeistof (bv het peil van een waterloop, uitgedrukt in meter TAW). De radar meet het tijdsinterval tussen het uitzenden en ontvangen van radiogolven en bepaald hiermee de afstand (hoogte) tot een object (water). Het resultaat wordt omgezet in een uitleesbaar signaal.
"	""	""	"true"	"https://wegenenverkeer.data.vlaanderen.be/ns/onderdeel#"	"RadarNiveaumeting"	"http://www.w3.org/2000/01/rdf-schema#Class"	""	""	"https://wegenenverkeer.data.vlaanderen.be/ns/abstracten#Niveaumeting"	""	""
"CLASS"	"OSLO-Onderdeel"	"Vlotterschakelaar"	"{1388B1E7-A8DD-4711-A799-7C2A90A12C44}"	"Niveaumeting"	""	""	""	"Vlotterschakelaar"	"Een inrichting voor het bepalen van het peil van een vloeistof (bv. het waterniveau in een lekwaterput van een kelder of het waterniveau van een waterloop). Een vlotterschakelaar (peilpeer) genereert een stuursignaal door op- en neer te bewegen en contact te maken met discrete contactpunten. De combinatie van verschillende peilperen levert een niveaumeting op.
"	""	"Vlotterschakelaar"	"Een inrichting voor het bepalen van het peil van een vloeistof (bv. het waterniveau in een lekwaterput van een kelder of het waterniveau van een waterloop). Een vlotterschakelaar (peilpeer) genereert een stuursignaal door op- en neer te bewegen en contact te maken met discrete contactpunten. De combinatie van verschillende peilperen levert een niveaumeting op.
"	""	""	"true"	"https://wegenenverkeer.data.vlaanderen.be/ns/onderdeel#"	"Vlotterschakelaar"	"http://www.w3.org/2000/01/rdf-schema#Class"	""	""	"https://wegenenverkeer.data.vlaanderen.be/ns/abstracten#Niveaumeting"	""	""
"CLASS"	"OSLO-Abstracten"	"Toegangselement"	"{5F4915B8-6995-4176-A59D-DAF82412F93B}"	""	""	""	""	"Toegangselement"	"Abstracte voor het groeperen van de relaties voor elementen die toegang verschaffen tot een behuizing of locatie."	""	"Toegangselement"	"Abstracte voor het groeperen van de relaties voor elementen die toegang verschaffen tot een behuizing of locatie."	""	""	"true"	"https://wegenenverkeer.data.vlaanderen.be/ns/abstracten#"	"Toegangselement"	"http://www.w3.org/2000/01/rdf-schema#Class"	""	""	""	""	""
"CLASS"	"OSLO-Onderdeel"	"ZuilTGC"	"{93D1A3D6-F712-43dc-A218-54F3E960A1DB}"	""	""	""	""	"Zuil toegangscontrole"	"Een zuil om badgelezers en videofoonposten op te plaatsen. Deze bevinden zich typisch aan slagbomen of automatische poorten."	""	"Zuil toegangscontrole"	"Een zuil om badgelezers en videofoonposten op te plaatsen. Deze bevinden zich typisch aan slagbomen of automatische poorten."	""	""	"true"	"https://wegenenverkeer.data.vlaanderen.be/ns/onderdeel#"	"ZuilTGC"	"http://www.w3.org/2000/01/rdf-schema#Class"	""	""	"https://wegenenverkeer.data.vlaanderen.be/ns/implementatieelement#AIMNaamObject, https://wegenenverkeer.data.vlaanderen.be/ns/abstracten#SerienummerObject"	""	""
"CLASS"	"OSLO-Onderdeel"	"Toegangscontrole"	"{FD8E4982-E803-4f0c-BDBE-258231315B9A}"	""	""	""	""	"Toegangscontrole"	"Component voor controle van de toegang tot een ruimte of behuizing."	""	"Toegangscontrole"	"Component voor controle van de toegang tot een ruimte of behuizing."	""	""	"true"	"https://wegenenverkeer.data.vlaanderen.be/ns/onderdeel#"	"Toegangscontrole"	"http://www.w3.org/2000/01/rdf-schema#Class"	""	""	"https://wegenenverkeer.data.vlaanderen.be/ns/implementatieelement#AIMNaamObject"	""	""
"CLASS"	"OSLO-Abstracten"	"Behuizing"	"{67A39958-2892-4f61-9857-45EA5FE9F26C}"	""	""	""	""	"Behuizing"	"Abstracte voor alle types van behuizing voor het beschermen van technieken."	""	"Behuizing"	"Abstracte voor alle types van behuizing voor het beschermen van technieken."	""	""	"true"	"https://wegenenverkeer.data.vlaanderen.be/ns/abstracten#"	"Behuizing"	"http://www.w3.org/2000/01/rdf-schema#Class"	""	""	"https://wegenenverkeer.data.vlaanderen.be/ns/implementatieelement#AIMNaamObject"	""	""
"CLASS"	"OSLO-Onderdeel"	"Toegangscontroller"	"{790EC598-E813-4b6b-98BE-355835A9E36B}"	""	""	""	""	"Toegangscontroller"	"Toestel dat een aantal vaste deurmodules voor een toegangscontrolepunt verbindt met een centrale server. Het kan uitgebreid worden met bijkomende deurmodules."	"Gebruik de aparte assettypes IPModuleTGC, DeurmoduleTGC en IOModule voor complexere, volledige modulaire systemem waarvan de modules apart  beheerd kunnen worden."	"Toegangscontroller"	"Toestel dat een aantal vaste deurmodules voor een toegangscontrolepunt verbindt met een centrale server. Het kan uitgebreid worden met bijkomende deurmodules."	""	""	"true"	"https://wegenenverkeer.data.vlaanderen.be/ns/onderdeel#"	"Toegangscontroller"	"http://www.w3.org/2000/01/rdf-schema#Class"	""	""	"https://wegenenverkeer.data.vlaanderen.be/ns/abstracten#Controller"	""	""
"CLASS"	"OSLO-Onderdeel"	"Contactpunt"	"{DC50D416-E05A-4be0-9144-4F358B30D25D}"	""	""	""	""	"Contactpunt"	"Techniek voor het meten van een aan- of afwezigheid van contact tussen de onderdelen waaraan deze bevestigd is."	""	"Contactpunt"	"Techniek voor het meten van een aan- of afwezigheid van contact tussen de onderdelen waaraan deze bevestigd is."	""	""	"true"	"https://wegenenverkeer.data.vlaanderen.be/ns/onderdeel#"	"Contactpunt"	"http://www.w3.org/2000/01/rdf-schema#Class"	""	""	"https://wegenenverkeer.data.vlaanderen.be/ns/implementatieelement#AIMObject, https://wegenenverkeer.data.vlaanderen.be/ns/abstracten#SerienummerObject"	""	""
"CLASS"	"OSLO-Onderdeel"	"Badgelezer"	"{79944539-AEF4-413e-98E1-26A623CBE6B5}"	""	""	""	""	"Badgelezer"	"Een inrichting voor automatische authenticatie op basis van een badge."	""	"Badgelezer"	"Een inrichting voor automatische authenticatie op basis van een badge."	""	""	"true"	"https://wegenenverkeer.data.vlaanderen.be/ns/onderdeel#"	"Badgelezer"	"http://www.w3.org/2000/01/rdf-schema#Class"	""	""	"https://wegenenverkeer.data.vlaanderen.be/ns/implementatieelement#AIMNaamObject, https://wegenenverkeer.data.vlaanderen.be/ns/abstracten#FirmwareObject, https://wegenenverkeer.data.vlaanderen.be/ns/abstracten#SerienummerObject, https://wegenenverkeer.data.vlaanderen.be/ns/abstracten#ElektrischComponentennummerObject"	""	""
"CLASS"	"OSLO-Onderdeel"	"Veiligheidsrelais"	"{607EE749-6BC4-492a-9238-D60529F27C97}"	""	""	""	""	"Veilgheidsrelais"	"Relais voor de bewaking van de noodstop binnen het noodstopcircuit. Voldoet omwille aan specifieke vereisten om te vermijden dat een storing tot een verlies van de veiligheidsfunctie kan leiden."	""	"Veilgheidsrelais"	"Relais voor de bewaking van de noodstop binnen het noodstopcircuit. Voldoet omwille aan specifieke vereisten om te vermijden dat een storing tot een verlies van de veiligheidsfunctie kan leiden."	""	""	"true"	"https://wegenenverkeer.data.vlaanderen.be/ns/onderdeel#"	"Veiligheidsrelais"	"http://www.w3.org/2000/01/rdf-schema#Class"	""	""	"https://wegenenverkeer.data.vlaanderen.be/ns/implementatieelement#AIMNaamObject, https://wegenenverkeer.data.vlaanderen.be/ns/abstracten#SerienummerObject, https://wegenenverkeer.data.vlaanderen.be/ns/abstracten#ElektrischComponentennummerObject"	""	""
"CLASS"	"OSLO-Onderdeel"	"Laagspanningsbord"	"{BF4FA0DA-DEE9-4181-B0F3-6B24242CB247}"	""	""	""	""	"Laagspanningsbord"	"Verzameling van alle elektrische componenten nodig voor de voeding en sturing van applicaties die erop aangesloten zijn. Omvat onder andere automaten,klemmenblokken,..."	""	"Laagspanningsbord"	"Verzameling van alle elektrische componenten nodig voor de voeding en sturing van applicaties die erop aangesloten zijn. Omvat onder andere automaten,klemmenblokken,..."	""	""	"true"	"https://wegenenverkeer.data.vlaanderen.be/ns/onderdeel#"	"Laagspanningsbord"	"http://www.w3.org/2000/01/rdf-schema#Class"	""	""	"https://wegenenverkeer.data.vlaanderen.be/ns/implementatieelement#AIMNaamObject"	""	""
"CLASS"	"OSLO-Onderdeel"	"Lockerkast"	"{9C3EEC39-7C27-4265-8058-CA379051427C}"	"Kast"	""	""	""	"Lockerkast"	"Een lockerkast is een geheel dat onderverdeeld is in een aantal kleinere en smallere opslagruimtes, bedoeld voor het opslaan van persoonlijke goederen of bezittingen. De lockers kunnen vaak afzonderlijk geopend en afgesloten worden. "	""	"Lockerkast"	"Een lockerkast is een geheel dat onderverdeeld is in een aantal kleinere en smallere opslagruimtes, bedoeld voor het opslaan van persoonlijke goederen of bezittingen. De lockers kunnen vaak afzonderlijk geopend en afgesloten worden. "	""	""	"true"	"https://wegenenverkeer.data.vlaanderen.be/ns/onderdeel#"	"Lockerkast"	"http://www.w3.org/2000/01/rdf-schema#Class"	""	""	"https://wegenenverkeer.data.vlaanderen.be/ns/abstracten#Kast"	""	""
"CLASS"	"OSLO-Onderdeel"	"Afsluiting"	"{9C52C045-C441-4ad3-A5BD-C082E3A92A50}"	""	""	""	""	"Afsluiting"	"Op het terrein ondubbelzinnig aanwijsbare en permanent verankerde scheiding."	""	"Afsluiting"	"Op het terrein ondubbelzinnig aanwijsbare en permanent verankerde scheiding."	""	""	"true"	"https://wegenenverkeer.data.vlaanderen.be/ns/onderdeel#"	"Afsluiting"	"http://www.w3.org/2000/01/rdf-schema#Class"	""	""	"https://wegenenverkeer.data.vlaanderen.be/ns/implementatieelement#AIMObject"	""	""
"CLASS"	"OSLO-Onderdeel"	"DNBLaagspanning"	"{DAB4BD74-4508-4e7c-9301-7928132C8D78}"	""	""	""	""	"DNB laagspanning"	"Aansluiting op het laagspanningsnet van de distributienetbeheerder."	""	"DNB laagspanning"	"Aansluiting op het laagspanningsnet van de distributienetbeheerder."	""	""	"true"	"https://wegenenverkeer.data.vlaanderen.be/ns/onderdeel#"	"DNBLaagspanning"	"http://www.w3.org/2000/01/rdf-schema#Class"	""	""	"https://wegenenverkeer.data.vlaanderen.be/ns/abstracten#DNB"	""	""
"CLASS"	"OSLO-Abstracten"	"Verlichtingstoestel"	"{5A115294-9730-4015-AA66-C59F28983DC4}"	""	""	""	""	"Verlichtingstoestel"	"Abstracte voor het geheel van de lichtbron en de behuizing die werden samengesteld met als doel:
* de lichtstroom van de lichtbronnen hoofdzakelijk op het te verlichten oppervlak (doorlopende wegsectie, conflictgebied,...) te richten, teneinde de zichtbaarheid te verhogen;
* de lichtstroom te beheersen zodat de weggebruikers niet verblind worden en de lichthinder beperkt wordt;
* het optisch systeem, de lichtbronnen en de hulpapparatuur tegen uitwendige invloeden te beschermen"	""	"Verlichtingstoestel"	"Abstracte voor het geheel van de lichtbron en de behuizing die werden samengesteld met als doel:
* de lichtstroom van de lichtbronnen hoofdzakelijk op het te verlichten oppervlak (doorlopende wegsectie, conflictgebied,...) te richten, teneinde de zichtbaarheid te verhogen;
* de lichtstroom te beheersen zodat de weggebruikers niet verblind worden en de lichthinder beperkt wordt;
* het optisch systeem, de lichtbronnen en de hulpapparatuur tegen uitwendige invloeden te beschermen"	""	""	"true"	"https://wegenenverkeer.data.vlaanderen.be/ns/abstracten#"	"Verlichtingstoestel"	"http://www.w3.org/2000/01/rdf-schema#Class"	""	""	"https://wegenenverkeer.data.vlaanderen.be/ns/implementatieelement#AIMNaamObject"	""	""
"CLASS"	"OSLO-Onderdeel"	"Bevestigingsbeugel"	"{CF892540-6A41-4e1c-975C-5290D598A551}"	""	""	""	""	"Bevestigingsbeugel"	"Verbindingsstuk waarmee een object kan vastgemaakt worden aan een steun of oppervlak."	""	"Bevestigingsbeugel"	"Verbindingsstuk waarmee een object kan vastgemaakt worden aan een steun of oppervlak."	""	""	"true"	"https://wegenenverkeer.data.vlaanderen.be/ns/onderdeel#"	"Bevestigingsbeugel"	"http://www.w3.org/2000/01/rdf-schema#Class"	""	""	"https://wegenenverkeer.data.vlaanderen.be/ns/implementatieelement#AIMNaamObject, https://wegenenverkeer.data.vlaanderen.be/ns/abstracten#BevestigingGC"	""	""
"CLASS"	"OSLO-Onderdeel"	"IntercomToestel"	"{22528038-0DFE-4cdf-AC3B-F5FFCF98B9BB}"	""	""	""	""	"Intercom toestel"	"Het toestel dat deel uitmaakt van een intercomsysteem en audio- en/of videocommunicatie tussen twee personen mogelijk maakt."	""	"Intercom toestel"	"Het toestel dat deel uitmaakt van een intercomsysteem en audio- en/of videocommunicatie tussen twee personen mogelijk maakt."	""	""	"true"	"https://wegenenverkeer.data.vlaanderen.be/ns/onderdeel#"	"IntercomToestel"	"http://www.w3.org/2000/01/rdf-schema#Class"	""	""	"https://wegenenverkeer.data.vlaanderen.be/ns/implementatieelement#AIMNaamObject"	""	""
"CLASS"	"OSLO-Onderdeel"	"Luidspreker"	"{9DEDB15B-BD6A-478d-BB6D-388D7F2AB5C1}"	""	""	""	""	"Luidspreker"	"Een luidspreker is een apparaat waarmee elektrische signalen worden omgezet in geluid."	""	"Luidspreker"	"Een luidspreker is een apparaat waarmee elektrische signalen worden omgezet in geluid."	""	""	"true"	"https://wegenenverkeer.data.vlaanderen.be/ns/onderdeel#"	"Luidspreker"	"http://www.w3.org/2000/01/rdf-schema#Class"	""	""	"https://wegenenverkeer.data.vlaanderen.be/ns/implementatieelement#AIMNaamObject"	""	""
"CLASS"	"OSLO-Onderdeel"	"Camera"	"{DA10504C-AFBE-42f6-857E-D494CFDB95A4}"	""	""	""	""	"Camera"	"Een CCTV-camera, closed-circuit television camera, kortweg camera, produceert beelden of opnames voor bewaking van een regio vanop afstand. Het is een element dat beelden neemt van een locatie en deze doorgeeft naar verschillende partijen om zo de werkelijke situatie te kunnen inschatten vanop afstand. Deze camera kan van het analoge type zijn of digitaal."	""	"Camera"	"Een CCTV-camera, closed-circuit television camera, kortweg camera, produceert beelden of opnames voor bewaking van een regio vanop afstand. Het is een element dat beelden neemt van een locatie en deze doorgeeft naar verschillende partijen om zo de werkelijke situatie te kunnen inschatten vanop afstand. Deze camera kan van het analoge type zijn of digitaal."	""	""	"true"	"https://wegenenverkeer.data.vlaanderen.be/ns/onderdeel#"	"Camera"	"http://www.w3.org/2000/01/rdf-schema#Class"	""	""	"https://wegenenverkeer.data.vlaanderen.be/ns/implementatieelement#AIMNaamObject"	""	""
"CLASS"	"OSLO-Onderdeel"	"Omvormer"	"{A1BBF9C3-F181-4344-A305-BB32B872EA4A}"	""	""	""	""	"Omvormer"	"Een object, bijna altijd geplaatst in paar geplaatst, omvorming en ""de""-omvorming, dat een signaal binnenneemt en terug uitstuurt maar dan op een andere manier. Er zijn een hele reeks manieren. - Omvorming waar er gewijzigd wordt van type kabel om dezelfde boodschap over te versturen, bv. omvorming van UTP naar Coax. - Omvorming van codering bv. analoog naar digitaal en in omgekeerde richting digitaal naar analoog (omvorming van codering analoog-digitaal verschilt van een encoder omdat een encoder een eindproduct aflevert; in dit geval is de omvorming ter ondersteuning het transport en zal er altijd een omvorming zijn terug naar analoog) - Omvorming die de gegevens opnieuw versterkt zodat ze over een langere afstand kunnen getransporteerd worden. Deze variant heeft niet noodzakelijk een tweede omvormer om terug te gaan naar het origineel."	""	"Omvormer"	"Een object, bijna altijd geplaatst in paar geplaatst, omvorming en ""de""-omvorming, dat een signaal binnenneemt en terug uitstuurt maar dan op een andere manier. Er zijn een hele reeks manieren. - Omvorming waar er gewijzigd wordt van type kabel om dezelfde boodschap over te versturen, bv. omvorming van UTP naar Coax. - Omvorming van codering bv. analoog naar digitaal en in omgekeerde richting digitaal naar analoog (omvorming van codering analoog-digitaal verschilt van een encoder omdat een encoder een eindproduct aflevert; in dit geval is de omvorming ter ondersteuning het transport en zal er altijd een omvorming zijn terug naar analoog) - Omvorming die de gegevens opnieuw versterkt zodat ze over een langere afstand kunnen getransporteerd worden. Deze variant heeft niet noodzakelijk een tweede omvormer om terug te gaan naar het origineel."	""	""	"true"	"https://wegenenverkeer.data.vlaanderen.be/ns/onderdeel#"	"Omvormer"	"http://www.w3.org/2000/01/rdf-schema#Class"	""	""	"https://wegenenverkeer.data.vlaanderen.be/ns/implementatieelement#AIMNaamObject, https://wegenenverkeer.data.vlaanderen.be/ns/abstracten#RHZModule"	""	""
"CLASS"	"OSLO-Abstracten"	"Draagconstructie"	"{C1093B52-E90F-4b82-A3D3-DB7D8AAE1271}"	""	""	""	""	"Draagconstructie"	"Abstracte voor alle draagconstructies."	""	"Draagconstructie"	"Abstracte voor alle draagconstructies."	""	""	"true"	"https://wegenenverkeer.data.vlaanderen.be/ns/abstracten#"	"Draagconstructie"	"http://www.w3.org/2000/01/rdf-schema#Class"	""	""	""	""	""
"CLASS"	"OSLO-Installatie"	"Zoutbijlaadplaats"	"{3FE8783F-6E79-44f7-91F7-95B3F74F99BF}"	""	""	""	""	"Zoutbijlaadplaats"	"Site in het beheer van een district, waar strooiwagens zout of pekel kunnen bijladen, wanneer ze tijdens de winterdienst hun strooiroute afleggen. De leverancier kan toegang krijgen (batch of codeklavier) om de tanks of de silos terug te vullen."	""	"Zoutbijlaadplaats"	"Site in het beheer van een district, waar strooiwagens zout of pekel kunnen bijladen, wanneer ze tijdens de winterdienst hun strooiroute afleggen. De leverancier kan toegang krijgen (batch of codeklavier) om de tanks of de silos terug te vullen."	""	""	"true"	"https://wegenenverkeer.data.vlaanderen.be/ns/installatie#"	"Zoutbijlaadplaats"	"http://www.w3.org/2000/01/rdf-schema#Class"	""	""	"https://wegenenverkeer.data.vlaanderen.be/ns/implementatieelement#AIMNaamObject"	""	""
"CLASS"	"OSLO-Onderdeel"	"Tank"	"{DB303BEE-DFFA-4f48-A90C-028038147BE6}"	""	""	""	""	"tank"	"Een constructie voor het opslaan van goederen, typisch in vloeibare of gasvormige toestand, zoals water, brandstof, aardgas, lucht, etc."	""	"tank"	"Een constructie voor het opslaan van goederen, typisch in vloeibare of gasvormige toestand, zoals water, brandstof, aardgas, lucht, etc."	""	""	"true"	"https://wegenenverkeer.data.vlaanderen.be/ns/onderdeel#"	"Tank"	"http://www.w3.org/2000/01/rdf-schema#Class"	""	""	"https://wegenenverkeer.data.vlaanderen.be/ns/implementatieelement#AIMNaamObject"	""	""
