"EA-Type"	"EA-Package"	"EA-Name"	"EA-GUID"	"EA-Parent"	"EA-Domain"	"EA-Domain-GUID"	"EA-Range"	"label"	"definition"	"usage"	"ap-label-nl"	"ap-definition-nl"	"ap-usageNote-nl"	"ap-codelist"	"external term"	"namespace"	"localname"	"type"	"domain"	"range"	"parent"	"min card"	"max card"
"Package"	""	"OSLO-Toegangscontrole"	"{2B13B3EA-0869-40b9-842C-E1548C90F0D9}"	""	""	""	""	""	""	""	""	""	""	""	""	"http://"	"fixme.com"	"http://www.w3.org/2002/07/owl#Ontology"	""	""	""	""	""
"CLASS"	"OSLO-Onderdeel"	"Toegangspoort"	"{B42B1CF8-B6B0-46a0-BFB5-FF05D59D13E8}"	"Toegangselement"	""	""	""	"Toegangspoort"	"Element dat een bredere doorgang in een constructie of hekwerk afsluit ."	""	"Toegangspoort"	"Element dat een bredere doorgang in een constructie of hekwerk afsluit ."	""	""	"true"	"https://wegenenverkeer-test.data.vlaanderen.be/ns/onderdeel#"	"Toegangspoort"	"http://www.w3.org/2000/01/rdf-schema#Class"	""	""	"https://wegenenverkeer-test.data.vlaanderen.be/ns/implementatieelement#AIMNaamObject, https://wegenenverkeer-test.data.vlaanderen.be/ns/abstracten#Toegangselement"	""	""
"CLASS"	"OSLO-Onderdeel"	"ANPRCamera"	"{048E053C-AEF1-4490-ACF8-345DD4B5B76F}"	""	""	""	""	"ANPR camera"	"Nummerplaatherkenningscamera: een camera die als output de nummerplaat van een voertuig in tekst geeft en een foto van het deel van het voertuig waar de nummerplaat zich bevindt. Afhankelijk van het merk en type gecombineerd met een al dan niet bewegend overzichtsbeeld."	""	"ANPR camera"	"Nummerplaatherkenningscamera: een camera die als output de nummerplaat van een voertuig in tekst geeft en een foto van het deel van het voertuig waar de nummerplaat zich bevindt. Afhankelijk van het merk en type gecombineerd met een al dan niet bewegend overzichtsbeeld."	""	""	"true"	"https://wegenenverkeer-test.data.vlaanderen.be/ns/onderdeel#"	"ANPRCamera"	"http://www.w3.org/2000/01/rdf-schema#Class"	""	""	"https://wegenenverkeer-test.data.vlaanderen.be/ns/implementatieelement#AIMNaamObject"	""	""
"CLASS"	"OSLO-Onderdeel"	"Afsluiting"	"{9C52C045-C441-4ad3-A5BD-C082E3A92A50}"	""	""	""	""	"Afsluiting"	"Op het terrein ondubbelzinnig aanwijsbare en permanent verankerde scheiding."	""	"Afsluiting"	"Op het terrein ondubbelzinnig aanwijsbare en permanent verankerde scheiding."	""	""	"true"	"https://wegenenverkeer-test.data.vlaanderen.be/ns/onderdeel#"	"Afsluiting"	"http://www.w3.org/2000/01/rdf-schema#Class"	""	""	"https://wegenenverkeer-test.data.vlaanderen.be/ns/implementatieelement#AIMObject"	""	""
"CLASS"	"OSLO-Onderdeel"	"Magneetgrendel"	"{AF539FEF-435C-4777-94AE-915DB96A6FC3}"	""	""	""	""	"Magneetgrendel"	"Een magnetisch slot dat instaat voor het gesloten houden van deuren, poorten, luiken met een elektromagneet."	""	"Magneetgrendel"	"Een magnetisch slot dat instaat voor het gesloten houden van deuren, poorten, luiken met een elektromagneet."	""	""	"true"	"https://wegenenverkeer-test.data.vlaanderen.be/ns/onderdeel#"	"Magneetgrendel"	"http://www.w3.org/2000/01/rdf-schema#Class"	""	""	"https://wegenenverkeer-test.data.vlaanderen.be/ns/implementatieelement#AIMObject, https://wegenenverkeer-test.data.vlaanderen.be/ns/abstracten#SerienummerObject, https://wegenenverkeer-test.data.vlaanderen.be/ns/abstracten#ElektrischComponentennummerObject"	""	""
"CLASS"	"OSLO-Onderdeel"	"IntercomToestel"	"{22528038-0DFE-4cdf-AC3B-F5FFCF98B9BB}"	""	""	""	""	"Intercom toestel"	"Het toestel dat deel uitmaakt van een intercomsysteem en audio- en/of videocommunicatie tussen twee personen mogelijk maakt."	""	"Intercom toestel"	"Het toestel dat deel uitmaakt van een intercomsysteem en audio- en/of videocommunicatie tussen twee personen mogelijk maakt."	""	""	"true"	"https://wegenenverkeer-test.data.vlaanderen.be/ns/onderdeel#"	"IntercomToestel"	"http://www.w3.org/2000/01/rdf-schema#Class"	""	""	"https://wegenenverkeer-test.data.vlaanderen.be/ns/implementatieelement#AIMNaamObject"	""	""
"CLASS"	"OSLO-Abstracten"	"Deur"	"{4CBA80E1-31C0-4f47-BEDA-1C14F186B663}"	"Toegangselement"	""	""	""	"Deur"	"Een beweegbaar element ter afsluiting van een ruimte. In een gebouw is een deur meestal bevestigd in een kozijn,dat weer in een muur of wand is aangebracht."	""	"Deur"	"Een beweegbaar element ter afsluiting van een ruimte. In een gebouw is een deur meestal bevestigd in een kozijn,dat weer in een muur of wand is aangebracht."	""	""	"true"	"https://wegenenverkeer-test.data.vlaanderen.be/ns/abstracten#"	"Deur"	"http://www.w3.org/2000/01/rdf-schema#Class"	""	""	"https://wegenenverkeer-test.data.vlaanderen.be/ns/abstracten#Toegangselement"	""	""
"CLASS"	"OSLO-Abstracten"	"Toegangselement"	"{5F4915B8-6995-4176-A59D-DAF82412F93B}"	""	""	""	""	"Toegangselement"	"Abstracte voor het groeperen van de relaties voor elementen die toegang verschaffen tot een behuizing of locatie."	""	"Toegangselement"	"Abstracte voor het groeperen van de relaties voor elementen die toegang verschaffen tot een behuizing of locatie."	""	""	"true"	"https://wegenenverkeer-test.data.vlaanderen.be/ns/abstracten#"	"Toegangselement"	"http://www.w3.org/2000/01/rdf-schema#Class"	""	""	""	""	""
"CLASS"	"OSLO-Onderdeel"	"Rack"	"{A82230B8-60B4-4fbc-BA51-009E17F0B1D9}"	""	""	""	""	"Rack"	"Interne draagstructuur binnen een behuizing voor (elektromechanische) toestellen."	""	"Rack"	"Interne draagstructuur binnen een behuizing voor (elektromechanische) toestellen."	""	""	"true"	"https://wegenenverkeer-test.data.vlaanderen.be/ns/onderdeel#"	"Rack"	"http://www.w3.org/2000/01/rdf-schema#Class"	""	""	"https://wegenenverkeer-test.data.vlaanderen.be/ns/implementatieelement#AIMNaamObject"	""	""
"CLASS"	"OSLO-Abstracten"	"ConstructieElement"	"{917FBCD6-FAE5-4b0a-94ED-2D7B8053BE7C}"	""	""	""	""	"Constructie element"	"Abstracte voor de verschillende constructie elementen."	""	"Constructie element"	"Abstracte voor de verschillende constructie elementen."	""	""	"true"	"https://wegenenverkeer-test.data.vlaanderen.be/ns/abstracten#"	"ConstructieElement"	"http://www.w3.org/2000/01/rdf-schema#Class"	""	""	"https://wegenenverkeer-test.data.vlaanderen.be/ns/implementatieelement#AIMObject"	""	""
"CLASS"	"OSLO-Abstracten"	"BekledingComponent"	"{360E2E2C-B78A-496b-A811-F39DC4C9E7AE}"	""	""	""	""	"Bekleding component"	"Abstracte voor componenten die als bekleding worden bevestigd op andere elementen."	""	"Bekleding component"	"Abstracte voor componenten die als bekleding worden bevestigd op andere elementen."	""	""	"true"	"https://wegenenverkeer-test.data.vlaanderen.be/ns/abstracten#"	"BekledingComponent"	"http://www.w3.org/2000/01/rdf-schema#Class"	""	""	"https://wegenenverkeer-test.data.vlaanderen.be/ns/implementatieelement#AIMObject"	""	""
"CLASS"	"OSLO-Onderdeel"	"ZuilTGC"	"{93D1A3D6-F712-43dc-A218-54F3E960A1DB}"	""	""	""	""	"Zuil toegangscontrole"	"Een zuil om badgelezers en videofoonposten op te plaatsen. Deze bevinden zich typisch aan slagbomen of automatische poorten."	""	"Zuil toegangscontrole"	"Een zuil om badgelezers en videofoonposten op te plaatsen. Deze bevinden zich typisch aan slagbomen of automatische poorten."	""	""	"true"	"https://wegenenverkeer-test.data.vlaanderen.be/ns/onderdeel#"	"ZuilTGC"	"http://www.w3.org/2000/01/rdf-schema#Class"	""	""	"https://wegenenverkeer-test.data.vlaanderen.be/ns/implementatieelement#AIMNaamObject, https://wegenenverkeer-test.data.vlaanderen.be/ns/abstracten#SerienummerObject"	""	""
"CLASS"	"OSLO-Onderdeel"	"Toegangsdeur"	"{D10BC77A-C44E-4021-8847-9727B05D0982}"	"Deur"	""	""	""	"Toegangsdeur"	"Element dat de doorgang naar een ruimte (in een gebouw) afsluit of er toegang toe verleent. De doorgang is minder breed dan die die afgesloten wordt door een toegangspoort."	""	"Toegangsdeur"	"Element dat de doorgang naar een ruimte (in een gebouw) afsluit of er toegang toe verleent. De doorgang is minder breed dan die die afgesloten wordt door een toegangspoort."	""	""	"true"	"https://wegenenverkeer-test.data.vlaanderen.be/ns/onderdeel#"	"Toegangsdeur"	"http://www.w3.org/2000/01/rdf-schema#Class"	""	""	"https://wegenenverkeer-test.data.vlaanderen.be/ns/implementatieelement#AIMNaamObject, https://wegenenverkeer-test.data.vlaanderen.be/ns/abstracten#Deur"	""	""
"CLASS"	"OSLO-Onderdeel"	"Batterij"	"{5934E0A6-C706-4a8a-9DF7-398F920B2995}"	""	""	""	""	"Batterij"	"Element bestaande uit meerdere elektrochemische cellen voor het leveren van elektriciteit,die ontstaat door de omzetting van opgeslagen chemische energie in elektrische energie."	""	"Batterij"	"Element bestaande uit meerdere elektrochemische cellen voor het leveren van elektriciteit,die ontstaat door de omzetting van opgeslagen chemische energie in elektrische energie."	""	""	"true"	"https://wegenenverkeer-test.data.vlaanderen.be/ns/onderdeel#"	"Batterij"	"http://www.w3.org/2000/01/rdf-schema#Class"	""	""	"https://wegenenverkeer-test.data.vlaanderen.be/ns/abstracten#Voedingspunt, https://wegenenverkeer-test.data.vlaanderen.be/ns/abstracten#SerienummerObject"	""	""
"CLASS"	"OSLO-Onderdeel"	"Zelfsluiter"	"{249327B2-8847-40ef-9431-8A5F9DBD7BCE}"	""	""	""	""	"Zelfsluiter"	"Mechanisme voor oa. deuren en poorten dat er voor zorgt dat de gekoppelde deur of poort sluit zonder verdere tussenkomst."	""	"Zelfsluiter"	"Mechanisme voor oa. deuren en poorten dat er voor zorgt dat de gekoppelde deur of poort sluit zonder verdere tussenkomst."	""	""	"true"	"https://wegenenverkeer-test.data.vlaanderen.be/ns/onderdeel#"	"Zelfsluiter"	"http://www.w3.org/2000/01/rdf-schema#Class"	""	""	"https://wegenenverkeer-test.data.vlaanderen.be/ns/implementatieelement#AIMNaamObject"	""	""
"CLASS"	"OSLO-Onderdeel"	"Toegangscontrole"	"{FD8E4982-E803-4f0c-BDBE-258231315B9A}"	""	""	""	""	"Toegangscontrole"	"Component voor controle van de toegang tot een ruimte of behuizing."	""	"Toegangscontrole"	"Component voor controle van de toegang tot een ruimte of behuizing."	""	""	"true"	"https://wegenenverkeer-test.data.vlaanderen.be/ns/onderdeel#"	"Toegangscontrole"	"http://www.w3.org/2000/01/rdf-schema#Class"	""	""	"https://wegenenverkeer-test.data.vlaanderen.be/ns/implementatieelement#AIMNaamObject"	""	""
"CLASS"	"OSLO-Abstracten"	"Behuizing"	"{67A39958-2892-4f61-9857-45EA5FE9F26C}"	""	""	""	""	"Behuizing"	"Abstracte voor alle types van behuizing voor het beschermen van technieken."	""	"Behuizing"	"Abstracte voor alle types van behuizing voor het beschermen van technieken."	""	""	"true"	"https://wegenenverkeer-test.data.vlaanderen.be/ns/abstracten#"	"Behuizing"	"http://www.w3.org/2000/01/rdf-schema#Class"	""	""	"https://wegenenverkeer-test.data.vlaanderen.be/ns/implementatieelement#AIMNaamObject"	""	""
"CLASS"	"OSLO-Onderdeel"	"Stroomkring"	"{24A2CB40-47FD-46fa-84E9-87E635ED1BFC}"	""	""	""	""	"Stroomkring"	"Ook wel vertrek of vertrekkende kabel genoemd. Afgezekerde elektrische geleiders waarmee de applicaties voorzien worden van de nodige voeding."	""	"Stroomkring"	"Ook wel vertrek of vertrekkende kabel genoemd. Afgezekerde elektrische geleiders waarmee de applicaties voorzien worden van de nodige voeding."	""	""	"true"	"https://wegenenverkeer-test.data.vlaanderen.be/ns/onderdeel#"	"Stroomkring"	"http://www.w3.org/2000/01/rdf-schema#Class"	""	""	"https://wegenenverkeer-test.data.vlaanderen.be/ns/implementatieelement#AIMNaamObject"	""	""
"CLASS"	"OSLO-Onderdeel"	"Binnenverlichtingstoestel"	"{D9BD3A05-C65E-43ec-AAEA-D61FF890B77D}"	""	""	""	""	"Binnenverlichtingstoestel"	"Een verlichtingstoestel dat binnen in een gebouw geplaatst wordt. Een verlichtingstoestel is de combinatie van de lamp en de armatuur."	""	"Binnenverlichtingstoestel"	"Een verlichtingstoestel dat binnen in een gebouw geplaatst wordt. Een verlichtingstoestel is de combinatie van de lamp en de armatuur."	""	""	"true"	"https://wegenenverkeer-test.data.vlaanderen.be/ns/onderdeel#"	"Binnenverlichtingstoestel"	"http://www.w3.org/2000/01/rdf-schema#Class"	""	""	"https://wegenenverkeer-test.data.vlaanderen.be/ns/implementatieelement#AIMObject"	""	""
"CLASS"	"OSLO-Onderdeel"	"Netwerkpoort"	"{2E04F022-D23F-4f64-B2B5-E78D3044EDAE}"	""	""	""	""	"Netwerkpoort"	"De ingang van het toestel samen met component die erop zit,bv. SFP of XFP."	""	"Netwerkpoort"	"De ingang van het toestel samen met component die erop zit,bv. SFP of XFP."	""	""	"true"	"https://wegenenverkeer-test.data.vlaanderen.be/ns/onderdeel#"	"Netwerkpoort"	"http://www.w3.org/2000/01/rdf-schema#Class"	""	""	"https://wegenenverkeer-test.data.vlaanderen.be/ns/implementatieelement#AIMNaamObject"	""	""
"CLASS"	"OSLO-Abstracten"	"Controller"	"{7E5C55B4-5B6B-4344-B8D5-AF0314A55250}"	""	""	""	""	"Controller"	"Abstracte voor allerlei types van controllers."	""	"Controller"	"Abstracte voor allerlei types van controllers."	""	""	"true"	"https://wegenenverkeer-test.data.vlaanderen.be/ns/abstracten#"	"Controller"	"http://www.w3.org/2000/01/rdf-schema#Class"	""	""	"https://wegenenverkeer-test.data.vlaanderen.be/ns/implementatieelement#AIMNaamObject"	""	""
"CLASS"	"OSLO-Onderdeel"	"IOModule"	"{E8936F3E-ED43-4b1b-B8BA-ECDB7A0C82D4}"	""	""	""	""	"I/O-module"	"Overgangsmodule om signalen om te zetten. Wordt ook wel een GPIO (General Purpose Input Output) module genoemd."	""	"I/O-module"	"Overgangsmodule om signalen om te zetten. Wordt ook wel een GPIO (General Purpose Input Output) module genoemd."	""	""	"true"	"https://wegenenverkeer-test.data.vlaanderen.be/ns/onderdeel#"	"IOModule"	"http://www.w3.org/2000/01/rdf-schema#Class"	""	""	"https://wegenenverkeer-test.data.vlaanderen.be/ns/implementatieelement#AIMNaamObject, https://wegenenverkeer-test.data.vlaanderen.be/ns/abstracten#SerienummerObject"	""	""
"CLASS"	"OSLO-Onderdeel"	"IPModuleTGC"	"{07A9DD1D-1E79-4f48-BD42-AA79C32F5880}"	""	""	""	""	"IP-module toegangscontrole"	"Deze controller voorziet de verbinding tussen de centrale server en de lokale toegangscontroller. Deze verbinding gebeurt over het IP-netwerk."	"Gebruik Toegangscontroller voor een minder modulair systeem dat de IP-component en de deurcontrollers combineert in één toestel."	"IP-module toegangscontrole"	"Deze controller voorziet de verbinding tussen de centrale server en de lokale toegangscontroller. Deze verbinding gebeurt over het IP-netwerk."	""	""	"true"	"https://wegenenverkeer-test.data.vlaanderen.be/ns/onderdeel#"	"IPModuleTGC"	"http://www.w3.org/2000/01/rdf-schema#Class"	""	""	"https://wegenenverkeer-test.data.vlaanderen.be/ns/implementatieelement#AIMNaamObject, https://wegenenverkeer-test.data.vlaanderen.be/ns/abstracten#FirmwareObject, https://wegenenverkeer-test.data.vlaanderen.be/ns/abstracten#IPNetwerkToegangObject, https://wegenenverkeer-test.data.vlaanderen.be/ns/abstracten#SerienummerObject, https://wegenenverkeer-test.data.vlaanderen.be/ns/abstracten#ElektrischComponentennummerObject"	""	""
"CLASS"	"OSLO-Onderdeel"	"DeurmoduleTGC"	"{22BF2E4D-BC3C-49df-8BD6-2885147B60C8}"	""	""	""	""	"Deurmodule toegangscontrole"	"Hardware interface tussen de IP-module en de toegangscontrolepunten op de site. Één deurmodule bestuurt doorgaans één of twee deuren."	""	"Deurmodule toegangscontrole"	"Hardware interface tussen de IP-module en de toegangscontrolepunten op de site. Één deurmodule bestuurt doorgaans één of twee deuren."	""	""	"true"	"https://wegenenverkeer-test.data.vlaanderen.be/ns/onderdeel#"	"DeurmoduleTGC"	"http://www.w3.org/2000/01/rdf-schema#Class"	""	""	"https://wegenenverkeer-test.data.vlaanderen.be/ns/implementatieelement#AIMNaamObject"	""	""
"CLASS"	"OSLO-Onderdeel"	"Toegangscontroller"	"{790EC598-E813-4b6b-98BE-355835A9E36B}"	"Controller"	""	""	""	"Toegangscontroller"	"Toestel dat een aantal vaste deurmodules voor een toegangscontrolepunt verbindt met een centrale server. Het kan uitgebreid worden met bijkomende deurmodules."	"Gebruik de aparte assettypes IPModuleTGC, DeurmoduleTGC en IOModule voor complexere, volledige modulaire systemem waarvan de modules apart  beheerd kunnen worden."	"Toegangscontroller"	"Toestel dat een aantal vaste deurmodules voor een toegangscontrolepunt verbindt met een centrale server. Het kan uitgebreid worden met bijkomende deurmodules."	""	""	"true"	"https://wegenenverkeer-test.data.vlaanderen.be/ns/onderdeel#"	"Toegangscontroller"	"http://www.w3.org/2000/01/rdf-schema#Class"	""	""	"https://wegenenverkeer-test.data.vlaanderen.be/ns/abstracten#Controller"	""	""
"CLASS"	"OSLO-Onderdeel"	"Klimaatsensor"	"{483BC597-618C-4a3e-BE4B-C2A5665CB823}"	""	""	""	""	"Klimaatsensor"	"Een sensor die een of meer klimatologische variabelen van een ruimte meet zoals bv. temperatuur, luchtvochtigheid of luchtdruk."	""	"Klimaatsensor"	"Een sensor die een of meer klimatologische variabelen van een ruimte meet zoals bv. temperatuur, luchtvochtigheid of luchtdruk."	""	""	"true"	"https://wegenenverkeer-test.data.vlaanderen.be/ns/onderdeel#"	"Klimaatsensor"	"http://www.w3.org/2000/01/rdf-schema#Class"	""	""	"https://wegenenverkeer-test.data.vlaanderen.be/ns/implementatieelement#AIMNaamObject, https://wegenenverkeer-test.data.vlaanderen.be/ns/abstracten#SerienummerObject"	""	""
"CLASS"	"OSLO-Onderdeel"	"Slot"	"{5ECDCAEA-42D8-49b1-85C8-10D443B942CF}"	""	""	""	""	"Slot"	"Onderdeel van het slotmechanisme dat instaat voor het gesloten houden van deuren, poorten, luiken. Dit is zonder de cilinder."	""	"Slot"	"Onderdeel van het slotmechanisme dat instaat voor het gesloten houden van deuren, poorten, luiken. Dit is zonder de cilinder."	""	""	"true"	"https://wegenenverkeer-test.data.vlaanderen.be/ns/onderdeel#"	"Slot"	"http://www.w3.org/2000/01/rdf-schema#Class"	""	""	"https://wegenenverkeer-test.data.vlaanderen.be/ns/implementatieelement#AIMNaamObject, https://wegenenverkeer-test.data.vlaanderen.be/ns/abstracten#SerienummerObject, https://wegenenverkeer-test.data.vlaanderen.be/ns/abstracten#ElektrischComponentennummerObject"	""	""
"CLASS"	"OSLO-Onderdeel"	"Slotcilinder"	"{2AB9DA49-2BF7-416c-9A30-EB2858E1AA62}"	""	""	""	""	"Slotcilinder"	"Onderdeel van het slotmechanisme waarin de sleutel wordt gestoken. Het slot kan enkel worden geopend door de juiste sleutel in de cilinder te steken en deze te draaien in de behuizing."	""	"Slotcilinder"	"Onderdeel van het slotmechanisme waarin de sleutel wordt gestoken. Het slot kan enkel worden geopend door de juiste sleutel in de cilinder te steken en deze te draaien in de behuizing."	""	""	"true"	"https://wegenenverkeer-test.data.vlaanderen.be/ns/onderdeel#"	"Slotcilinder"	"http://www.w3.org/2000/01/rdf-schema#Class"	""	""	"https://wegenenverkeer-test.data.vlaanderen.be/ns/implementatieelement#AIMNaamObject, https://wegenenverkeer-test.data.vlaanderen.be/ns/abstracten#SerienummerObject"	""	""
"CLASS"	"OSLO-Onderdeel"	"Contactpunt"	"{DC50D416-E05A-4be0-9144-4F358B30D25D}"	""	""	""	""	"Contactpunt"	"Techniek voor het meten van een aan- of afwezigheid van contact tussen de onderdelen waaraan deze bevestigd is."	""	"Contactpunt"	"Techniek voor het meten van een aan- of afwezigheid van contact tussen de onderdelen waaraan deze bevestigd is."	""	""	"true"	"https://wegenenverkeer-test.data.vlaanderen.be/ns/onderdeel#"	"Contactpunt"	"http://www.w3.org/2000/01/rdf-schema#Class"	""	""	"https://wegenenverkeer-test.data.vlaanderen.be/ns/implementatieelement#AIMObject, https://wegenenverkeer-test.data.vlaanderen.be/ns/abstracten#SerienummerObject"	""	""
"CLASS"	"OSLO-Onderdeel"	"Badgelezer"	"{79944539-AEF4-413e-98E1-26A623CBE6B5}"	""	""	""	""	"Badgelezer"	"Een inrichting voor automatische authenticatie op basis van een badge."	""	"Badgelezer"	"Een inrichting voor automatische authenticatie op basis van een badge."	""	""	"true"	"https://wegenenverkeer-test.data.vlaanderen.be/ns/onderdeel#"	"Badgelezer"	"http://www.w3.org/2000/01/rdf-schema#Class"	""	""	"https://wegenenverkeer-test.data.vlaanderen.be/ns/implementatieelement#AIMNaamObject, https://wegenenverkeer-test.data.vlaanderen.be/ns/abstracten#FirmwareObject, https://wegenenverkeer-test.data.vlaanderen.be/ns/abstracten#SerienummerObject, https://wegenenverkeer-test.data.vlaanderen.be/ns/abstracten#ElektrischComponentennummerObject"	""	""
"CLASS"	"OSLO-Implementatieelement"	"AIMNaamObject"	"{D59E256E-CE07-4237-8AA7-1787263D9B99}"	""	""	""	""	"AIM naam object"	"Abstracte als de basisklasse voor elk OTL object dat benoemd wordt met een mensleesbare identificator."	""	"AIM naam object"	"Abstracte als de basisklasse voor elk OTL object dat benoemd wordt met een mensleesbare identificator."	""	""	"true"	"https://wegenenverkeer-test.data.vlaanderen.be/ns/implementatieelement#"	"AIMNaamObject"	"http://www.w3.org/2000/01/rdf-schema#Class"	""	""	"https://wegenenverkeer-test.data.vlaanderen.be/ns/implementatieelement#AIMObject"	""	""
"CLASS"	"OSLO-Implementatieelement"	"AIMObject"	"{E988A721-4359-43b1-985E-AF081D82CB85}"	""	""	""	""	"AIM object"	"Abstracte als de basisklasse voor alle uniek geïdentificeerde OTL objecten met de basiseigenschappen die elk OTL object minstens heeft."	""	"AIM object"	"Abstracte als de basisklasse voor alle uniek geïdentificeerde OTL objecten met de basiseigenschappen die elk OTL object minstens heeft."	""	""	"true"	"https://wegenenverkeer-test.data.vlaanderen.be/ns/implementatieelement#"	"AIMObject"	"http://www.w3.org/2000/01/rdf-schema#Class"	""	""	"https://wegenenverkeer-test.data.vlaanderen.be/ns/implementatieelement#AIMToestand, https://wegenenverkeer-test.data.vlaanderen.be/ns/implementatieelement#AIMDBStatus"	""	""
"CLASS"	"OSLO-Implementatieelement"	"AIMToestand"	"{56AB9E47-A0BF-4e08-8CA5-0A50FB16E659}"	""	""	""	""	"AIM Toestand"	"Voegt een attribuut toe aan de subklasse dat de huidige stand in de levenscyclus van het object aangeeft."	""	"AIM Toestand"	"Voegt een attribuut toe aan de subklasse dat de huidige stand in de levenscyclus van het object aangeeft."	""	""	"true"	"https://wegenenverkeer-test.data.vlaanderen.be/ns/implementatieelement#"	"AIMToestand"	"http://www.w3.org/2000/01/rdf-schema#Class"	""	""	""	""	""
"CLASS"	"OSLO-Implementatieelement"	"AIMDBStatus"	"{0316AD39-D9FC-435c-8260-8E166A969FA4}"	""	""	""	""	"AIM databank status"	"Voegt een attribuut toe aan de subklasse dat aangeeft of de asset zichtbaar is in de databank of (zacht) verwijderd is."	""	"AIM databank status"	"Voegt een attribuut toe aan de subklasse dat aangeeft of de asset zichtbaar is in de databank of (zacht) verwijderd is."	""	""	"true"	"https://wegenenverkeer-test.data.vlaanderen.be/ns/implementatieelement#"	"AIMDBStatus"	"http://www.w3.org/2000/01/rdf-schema#Class"	""	""	""	""	""
"CLASS"	"OSLO-Abstracten"	"SerienummerObject"	"{A96733D5-B395-45cb-A97A-47C6E457AB4F}"	""	""	""	""	"Serienummerobject"	"Abstracte klasse voor een serienummer."	""	"Serienummerobject"	"Abstracte klasse voor een serienummer."	""	""	"true"	"https://wegenenverkeer-test.data.vlaanderen.be/ns/abstracten#"	"SerienummerObject"	"http://www.w3.org/2000/01/rdf-schema#Class"	""	""	""	""	""
"CLASS"	"OSLO-Abstracten"	"ElektrischComponentennummerObject"	"{A5545E54-169D-4f93-9B47-11BCED07BCB0}"	""	""	""	""	"Elektisch componentennummer object"	"Abstracte voor Objecttypes waarvoor het componentnummer op het lokale elektrische schema moet bijgehouden worden."	""	"Elektisch componentennummer object"	"Abstracte voor Objecttypes waarvoor het componentnummer op het lokale elektrische schema moet bijgehouden worden."	""	""	"true"	"https://wegenenverkeer-test.data.vlaanderen.be/ns/abstracten#"	"ElektrischComponentennummerObject"	"http://www.w3.org/2000/01/rdf-schema#Class"	""	""	""	""	""
"CLASS"	"OSLO-Abstracten"	"Voedingspunt"	"{AEA5D7F2-A679-4388-B1BB-5E545F18DF3A}"	""	""	""	""	"Voedingspunt"	"Abstracte voor het aansluitpunt van de voeding."	""	"Voedingspunt"	"Abstracte voor het aansluitpunt van de voeding."	""	""	"true"	"https://wegenenverkeer-test.data.vlaanderen.be/ns/abstracten#"	"Voedingspunt"	"http://www.w3.org/2000/01/rdf-schema#Class"	""	""	"https://wegenenverkeer-test.data.vlaanderen.be/ns/implementatieelement#AIMNaamObject"	""	""
"CLASS"	"OSLO-Abstracten"	"IPNetwerkToegangObject"	"{0F52F253-07DC-482a-93F8-8BA2F2CBFAD5}"	""	""	""	""	"IP netwerk object"	"Abstracte voor het IP adres en de DNS naam van een object."	""	"IP netwerk object"	"Abstracte voor het IP adres en de DNS naam van een object."	""	""	"true"	"https://wegenenverkeer-test.data.vlaanderen.be/ns/abstracten#"	"IPNetwerkToegangObject"	"http://www.w3.org/2000/01/rdf-schema#Class"	""	""	""	""	""
"CLASS"	"OSLO-Abstracten"	"FirmwareObject"	"{5DF379D1-741A-4be6-BE8B-4A599C7F95FE}"	""	""	""	""	"Firmware object"	"Abstracte voor de firmware van het object."	""	"Firmware object"	"Abstracte voor de firmware van het object."	""	""	"true"	"https://wegenenverkeer-test.data.vlaanderen.be/ns/abstracten#"	"FirmwareObject"	"http://www.w3.org/2000/01/rdf-schema#Class"	""	""	""	""	""
"DATATYPE"	"OSLO-Implementatieelement"	"KwantWrdInCentimeter"	"{4EDCC34B-4D09-4eac-9B1C-78B67973D1B1}"	""	""	""	""	"Kwantitatieve waarde in centimeter"	"Een kwantitatieve waarde die een getal in centimeter uitdrukt."	""	"Kwantitatieve waarde in centimeter"	"Een kwantitatieve waarde die een getal in centimeter uitdrukt."	""	""	"true"	"https://wegenenverkeer-test.data.vlaanderen.be/ns/implementatieelement#"	"KwantWrdInCentimeter"	"http://www.w3.org/2000/01/rdf-schema#Class"	""	""	""	""	""
"DATATYPE"	"W3-XML-Schema"	"Decimal"	"{3300D9AD-B706-43fe-B750-0EB2D8679F90}"	""	""	""	""	"Decimaal getal"	"Beschrijft een decimaal getal volgens http://www.w3.org/2001/XMLSchema#decimal."	"https://www.w3.org/TR/xmlschema-2/#decimal"	"Decimaal getal"	"Beschrijft een decimaal getal volgens http://www.w3.org/2001/XMLSchema#decimal."	""	""	"true"	"http://www.w3.org/2001/XMLSchema#"	"decimal"	"http://www.w3.org/2000/01/rdf-schema#Class"	""	""	""	""	""
"DATATYPE"	"W3-RDF-Schema"	"Literal"	"{FBE7CE2F-907F-4558-A0CE-70C0A8A6AA32}"	""	""	""	""	"Literal"	"Beschrijft een constante."	"http://www.w3.org/2000/01/rdf-schema#Literal"	"Literal"	"Beschrijft een constante."	""	""	"true"	"http://www.w3.org/2000/01/rdf-schema#"	"Literal"	"http://www.w3.org/2000/01/rdf-schema#Class"	""	""	""	""	""
