"EA-Type"	"EA-Package"	"EA-Name"	"EA-GUID"	"EA-Parent"	"EA-Domain"	"EA-Domain-GUID"	"EA-Range"	"label"	"definition"	"usage"	"ap-label-nl"	"ap-definition-nl"	"ap-usageNote-nl"	"ap-codelist"	"external term"	"namespace"	"localname"	"type"	"domain"	"range"	"parent"	"min card"	"max card"
"attribute"	"OSLO-Abstracten"	"sluitingstijd"	"{B7D4C791-5731-4873-A277-D90D0E276457}"	""	"Deur"	"{4CBA80E1-31C0-4f47-BEDA-1C14F186B663}"	"KwantWrdInSeconde"	"sluitingstijd"	"Duurtijd voor het automatische sluiten van een zelfsluitende deur die volledig open staat."	""	"sluitingstijd"	"Duurtijd voor het automatische sluiten van een zelfsluitende deur die volledig open staat."	""	""	"true"	"https://wegenenverkeer-test.data.vlaanderen.be/ns/abstracten#"	"Deur.sluitingstijd"	"http://www.w3.org/2002/07/owl#ObjectProperty"	"https://wegenenverkeer-test.data.vlaanderen.be/ns/abstracten#Deur"	"https://wegenenverkeer-test.data.vlaanderen.be/ns/implementatieelement#KwantWrdInSeconde"	""	"1"	"1"
"attribute"	"OSLO-Onderdeel"	"modelnaam"	"{F8793554-0250-4f31-B659-FCC4C071148E}"	""	"Rack"	"{A82230B8-60B4-4fbc-BA51-009E17F0B1D9}"	"KlRackModelnaam"	"modelnaam"	"Modelnaam waarmee de fabrikant dit type toestel identificeert."	""	"modelnaam"	"Modelnaam waarmee de fabrikant dit type toestel identificeert."	""	""	"true"	"https://wegenenverkeer-test.data.vlaanderen.be/ns/onderdeel#"	"Rack.modelnaam"	"http://www.w3.org/2002/07/owl#ObjectProperty"	"https://wegenenverkeer-test.data.vlaanderen.be/ns/onderdeel#Rack"	"http://www.w3.org/2004/02/skos/core#Concept"	""	"1"	"1"
"attribute"	"OSLO-Onderdeel"	"merk"	"{4F73D723-ECE6-4596-9AD8-175958F70574}"	""	"Rack"	"{A82230B8-60B4-4fbc-BA51-009E17F0B1D9}"	"KlRackMerk"	"merk"	"Merk waarmee de fabrikant dit type rack identificeert."	""	"merk"	"Merk waarmee de fabrikant dit type rack identificeert."	""	""	"true"	"https://wegenenverkeer-test.data.vlaanderen.be/ns/onderdeel#"	"Rack.merk"	"http://www.w3.org/2002/07/owl#ObjectProperty"	"https://wegenenverkeer-test.data.vlaanderen.be/ns/onderdeel#Rack"	"http://www.w3.org/2004/02/skos/core#Concept"	""	"1"	"1"
"attribute"	"OSLO-Onderdeel"	"hoogteInRU"	"{64ACDD32-2AAF-4097-B9F6-FC6CEC459BED}"	""	"Rack"	"{A82230B8-60B4-4fbc-BA51-009E17F0B1D9}"	"Integer"	"hoogte in RU"	"Bruikbare ruimte om toestellen te monteren, uitgedrukt in RU (rack units)."	""	"hoogte in RU"	"Bruikbare ruimte om toestellen te monteren, uitgedrukt in RU (rack units)."	""	""	"true"	"https://wegenenverkeer-test.data.vlaanderen.be/ns/onderdeel#"	"Rack.hoogteInRU"	"http://www.w3.org/2002/07/owl#DatatypeProperty"	"https://wegenenverkeer-test.data.vlaanderen.be/ns/onderdeel#Rack"	"http://www.w3.org/2001/XMLSchema#integer"	""	"1"	"1"
"attribute"	"OSLO-Onderdeel"	"huidigBeeld"	"{4F829516-9228-446e-BD78-FF85444BE2CF}"	""	"Rack"	"{A82230B8-60B4-4fbc-BA51-009E17F0B1D9}"	"DtcDocument"	"huidig beeld"	"Foto of schematische voorstelling van de huidige samenstelling van de samenstelling in het rack."	""	"huidig beeld"	"Foto of schematische voorstelling van de huidige samenstelling van de samenstelling in het rack."	""	""	"true"	"https://wegenenverkeer-test.data.vlaanderen.be/ns/onderdeel#"	"Rack.huidigBeeld"	"http://www.w3.org/2002/07/owl#ObjectProperty"	"https://wegenenverkeer-test.data.vlaanderen.be/ns/onderdeel#Rack"	"https://wegenenverkeer-test.data.vlaanderen.be/ns/implementatieelement#DtcDocument"	""	"1"	"1"
"attribute"	"OSLO-Onderdeel"	"diepte"	"{AD23316A-1815-4638-BD40-DEC2BAED2360}"	""	"Rack"	"{A82230B8-60B4-4fbc-BA51-009E17F0B1D9}"	"KwantWrdInCentimeter"	"diepte"	"De diepte van het rack tussen de voorste en achterste rails."	""	"diepte"	"De diepte van het rack tussen de voorste en achterste rails."	""	""	"true"	"https://wegenenverkeer-test.data.vlaanderen.be/ns/onderdeel#"	"Rack.diepte"	"http://www.w3.org/2002/07/owl#ObjectProperty"	"https://wegenenverkeer-test.data.vlaanderen.be/ns/onderdeel#Rack"	"https://wegenenverkeer-test.data.vlaanderen.be/ns/implementatieelement#KwantWrdInCentimeter"	""	"1"	"1"
"attribute"	"OSLO-Onderdeel"	"rackType"	"{34842ED8-0289-44bb-ACAD-74D988D5E50F}"	""	"Rack"	"{A82230B8-60B4-4fbc-BA51-009E17F0B1D9}"	"KlRackType"	"Rack type"	"Geeft het type aan voor een rack volgens een keuzelijst van beschikbare types."	""	"Rack type"	"Geeft het type aan voor een rack volgens een keuzelijst van beschikbare types."	""	""	"true"	"https://wegenenverkeer-test.data.vlaanderen.be/ns/onderdeel#"	"Rack.rackType"	"http://www.w3.org/2002/07/owl#ObjectProperty"	"https://wegenenverkeer-test.data.vlaanderen.be/ns/onderdeel#Rack"	"http://www.w3.org/2004/02/skos/core#Concept"	""	"1"	"1"
"attribute"	"OSLO-Onderdeel"	"merk"	"{65F2BEFE-5583-4770-867E-74A0E93C0AAC}"	""	"ZuilTGC"	"{93D1A3D6-F712-43dc-A218-54F3E960A1DB}"	"KlZuilTGCMerk"	"merk"	"Het merk van de zuil."	""	"merk"	"Het merk van de zuil."	""	""	"true"	"https://wegenenverkeer-test.data.vlaanderen.be/ns/onderdeel#"	"ZuilTGC.merk"	"http://www.w3.org/2002/07/owl#ObjectProperty"	"https://wegenenverkeer-test.data.vlaanderen.be/ns/onderdeel#ZuilTGC"	"http://www.w3.org/2004/02/skos/core#Concept"	""	"1"	"1"
"attribute"	"OSLO-Onderdeel"	"materiaal"	"{A2D42FAF-54BF-4844-A0C1-18B42E61D4EA}"	""	"ZuilTGC"	"{93D1A3D6-F712-43dc-A218-54F3E960A1DB}"	"KlAlgMateriaal"	"materiaal"	"Het materiaal waaruit de toegangscontrolezuil (voornamelijk) gemaakt is."	""	"materiaal"	"Het materiaal waaruit de toegangscontrolezuil (voornamelijk) gemaakt is."	""	""	"true"	"https://wegenenverkeer-test.data.vlaanderen.be/ns/onderdeel#"	"ZuilTGC.materiaal"	"http://www.w3.org/2002/07/owl#ObjectProperty"	"https://wegenenverkeer-test.data.vlaanderen.be/ns/onderdeel#ZuilTGC"	"http://www.w3.org/2004/02/skos/core#Concept"	""	"1"	"1"
"attribute"	"OSLO-Onderdeel"	"modelnaam"	"{8609EB57-B43D-4f88-B973-08817F9CDB83}"	""	"ZuilTGC"	"{93D1A3D6-F712-43dc-A218-54F3E960A1DB}"	"KlZuilTGCModelnaam"	"modelnaam"	"De modelnaam van de zuil."	""	"modelnaam"	"De modelnaam van de zuil."	""	""	"true"	"https://wegenenverkeer-test.data.vlaanderen.be/ns/onderdeel#"	"ZuilTGC.modelnaam"	"http://www.w3.org/2002/07/owl#ObjectProperty"	"https://wegenenverkeer-test.data.vlaanderen.be/ns/onderdeel#ZuilTGC"	"http://www.w3.org/2004/02/skos/core#Concept"	""	"1"	"1"
"attribute"	"OSLO-Onderdeel"	"isGeschiktVoorVrachtwagens"	"{AF33555F-1CAE-4396-B3CE-0036ED0D2433}"	""	"ZuilTGC"	"{93D1A3D6-F712-43dc-A218-54F3E960A1DB}"	"Boolean"	"is geschikt voor vrachtwagens"	"Geeft aan of de zuil een hoogte heeft die het geschikt maakt om te worden benut door chauffeurs van vrachtwagens."	""	"is geschikt voor vrachtwagens"	"Geeft aan of de zuil een hoogte heeft die het geschikt maakt om te worden benut door chauffeurs van vrachtwagens."	""	""	"true"	"https://wegenenverkeer-test.data.vlaanderen.be/ns/onderdeel#"	"ZuilTGC.isGeschiktVoorVrachtwagens"	"http://www.w3.org/2002/07/owl#DatatypeProperty"	"https://wegenenverkeer-test.data.vlaanderen.be/ns/onderdeel#ZuilTGC"	"http://www.w3.org/2001/XMLSchema#boolean"	""	"1"	"1"
"attribute"	"OSLO-Onderdeel"	"technischeFiche"	"{7253F64D-E6E5-48e6-AA30-90D3A3A09F0C}"	""	"ZuilTGC"	"{93D1A3D6-F712-43dc-A218-54F3E960A1DB}"	"DtcDocument"	"technische fiche"	"Documentatie met bijkomende (technische) details van de toegangscontrolezuil."	""	"technische fiche"	"Documentatie met bijkomende (technische) details van de toegangscontrolezuil."	""	""	"true"	"https://wegenenverkeer-test.data.vlaanderen.be/ns/onderdeel#"	"ZuilTGC.technischeFiche"	"http://www.w3.org/2002/07/owl#ObjectProperty"	"https://wegenenverkeer-test.data.vlaanderen.be/ns/onderdeel#ZuilTGC"	"https://wegenenverkeer-test.data.vlaanderen.be/ns/implementatieelement#DtcDocument"	""	"1"	"1"
"attribute"	"OSLO-Onderdeel"	"isGeschiktVoorPersonenvoertuigen"	"{6D894238-F67B-43fd-B0BA-04987C6C917C}"	""	"ZuilTGC"	"{93D1A3D6-F712-43dc-A218-54F3E960A1DB}"	"Boolean"	"is geschikt voor personenvoertuigen"	"Geeft aan of de zuil een hoogte heeft die het geschikt maakt om te worden benut door chauffeurs van personenvoertuigen. Doorgaans is de zuil dan ook geschikt voor voetgangers."	""	"is geschikt voor personenvoertuigen"	"Geeft aan of de zuil een hoogte heeft die het geschikt maakt om te worden benut door chauffeurs van personenvoertuigen. Doorgaans is de zuil dan ook geschikt voor voetgangers."	""	""	"true"	"https://wegenenverkeer-test.data.vlaanderen.be/ns/onderdeel#"	"ZuilTGC.isGeschiktVoorPersonenvoertuigen"	"http://www.w3.org/2002/07/owl#DatatypeProperty"	"https://wegenenverkeer-test.data.vlaanderen.be/ns/onderdeel#ZuilTGC"	"http://www.w3.org/2001/XMLSchema#boolean"	""	"1"	"1"
"attribute"	"OSLO-Onderdeel"	"isBinnendraaiend"	"{0B49CF04-07DC-4ce9-A1B4-C3E0EA3BDDEA}"	""	"Toegangsdeur"	"{D10BC77A-C44E-4021-8847-9727B05D0982}"	"Boolean"	"is binnendraaiend"	"Geeft aan of de deur in de af te sluiten ruimte draait of er weg van."	""	"is binnendraaiend"	"Geeft aan of de deur in de af te sluiten ruimte draait of er weg van."	""	""	"true"	"https://wegenenverkeer-test.data.vlaanderen.be/ns/onderdeel#"	"Toegangsdeur.isBinnendraaiend"	"http://www.w3.org/2002/07/owl#DatatypeProperty"	"https://wegenenverkeer-test.data.vlaanderen.be/ns/onderdeel#Toegangsdeur"	"http://www.w3.org/2001/XMLSchema#boolean"	""	"1"	"1"
"attribute"	"OSLO-Onderdeel"	"merk"	"{D162C77D-F69F-4fa6-BD47-F07161F85227}"	""	"Batterij"	"{5934E0A6-C706-4a8a-9DF7-398F920B2995}"	"KlBatterijMerk"	"merk"	"Merk van de batterij."	""	"merk"	"Merk van de batterij."	""	""	"true"	"https://wegenenverkeer-test.data.vlaanderen.be/ns/onderdeel#"	"Batterij.merk"	"http://www.w3.org/2002/07/owl#ObjectProperty"	"https://wegenenverkeer-test.data.vlaanderen.be/ns/onderdeel#Batterij"	"http://www.w3.org/2004/02/skos/core#Concept"	""	"1"	"1"
"attribute"	"OSLO-Onderdeel"	"modelnaam"	"{D1EE4FF1-16D1-4967-9DBC-FE50AD95CFD9}"	""	"Batterij"	"{5934E0A6-C706-4a8a-9DF7-398F920B2995}"	"KlBatterijModelnaam"	"modelnaam"	"Modelnaam van de batterij."	""	"modelnaam"	"Modelnaam van de batterij."	""	""	"true"	"https://wegenenverkeer-test.data.vlaanderen.be/ns/onderdeel#"	"Batterij.modelnaam"	"http://www.w3.org/2002/07/owl#ObjectProperty"	"https://wegenenverkeer-test.data.vlaanderen.be/ns/onderdeel#Batterij"	"http://www.w3.org/2004/02/skos/core#Concept"	""	"1"	"1"
"attribute"	"OSLO-Onderdeel"	"spanning"	"{D9CA89C1-1246-4ce3-B3FA-3A2A63382059}"	""	"Batterij"	"{5934E0A6-C706-4a8a-9DF7-398F920B2995}"	"KwantWrdInVolt"	"spanning"	"De spanning die de batterij kan leveren. Wordt ook wel het werkingsvoltage genoemd."	""	"spanning"	"De spanning die de batterij kan leveren. Wordt ook wel het werkingsvoltage genoemd."	""	""	"true"	"https://wegenenverkeer-test.data.vlaanderen.be/ns/onderdeel#"	"Batterij.spanning"	"http://www.w3.org/2002/07/owl#ObjectProperty"	"https://wegenenverkeer-test.data.vlaanderen.be/ns/onderdeel#Batterij"	"https://wegenenverkeer-test.data.vlaanderen.be/ns/implementatieelement#KwantWrdInVolt"	""	"1"	"1"
"attribute"	"OSLO-Onderdeel"	"lading"	"{2F3C2D87-A363-4002-A2D4-25D8809426A0}"	""	"Batterij"	"{5934E0A6-C706-4a8a-9DF7-398F920B2995}"	"KwantWrdInAmpereUur"	"lading"	"Wordt ook wel capaciteit of autonomie genoemd. Geeft aan hoe veel energie de batterij kan leveren in volledig opgeladen staat."	"Het gaat om de lading van de batterij vlak na productie wanneer de batterij volledig opgeladen is. De maximale lading dus."	"lading"	"Wordt ook wel capaciteit of autonomie genoemd. Geeft aan hoe veel energie de batterij kan leveren in volledig opgeladen staat."	""	""	"true"	"https://wegenenverkeer-test.data.vlaanderen.be/ns/onderdeel#"	"Batterij.lading"	"http://www.w3.org/2002/07/owl#ObjectProperty"	"https://wegenenverkeer-test.data.vlaanderen.be/ns/onderdeel#Batterij"	"https://wegenenverkeer-test.data.vlaanderen.be/ns/implementatieelement#KwantWrdInAmpereUur"	""	"1"	"1"
"attribute"	"OSLO-Onderdeel"	"fabricatiedatum"	"{40824B8C-9B2C-4cc6-AC12-8E88C3528CB0}"	""	"Batterij"	"{5934E0A6-C706-4a8a-9DF7-398F920B2995}"	"Date"	"fabricatiedatum"	"De datum waarop de batterij geproduceerd is."	""	"fabricatiedatum"	"De datum waarop de batterij geproduceerd is."	""	""	"true"	"https://wegenenverkeer-test.data.vlaanderen.be/ns/onderdeel#"	"Batterij.fabricatiedatum"	"http://www.w3.org/2002/07/owl#DatatypeProperty"	"https://wegenenverkeer-test.data.vlaanderen.be/ns/onderdeel#Batterij"	"http://www.w3.org/2001/XMLSchema#date"	""	"1"	"1"
"attribute"	"OSLO-Onderdeel"	"afmetingen"	"{7F6CE18C-175A-4418-995F-950B36E96379}"	""	"Batterij"	"{5934E0A6-C706-4a8a-9DF7-398F920B2995}"	"DtcAfmetingBxhInMm"	"afmetingen"	"De afmetingen van de batterij in millimeter."	""	"afmetingen"	"De afmetingen van de batterij in millimeter."	""	""	"true"	"https://wegenenverkeer-test.data.vlaanderen.be/ns/onderdeel#"	"Batterij.afmetingen"	"http://www.w3.org/2002/07/owl#ObjectProperty"	"https://wegenenverkeer-test.data.vlaanderen.be/ns/onderdeel#Batterij"	"https://wegenenverkeer-test.data.vlaanderen.be/ns/implementatieelement#DtcAfmetingBxhInMm"	""	"1"	"1"
"attribute"	"OSLO-Onderdeel"	"materiaal"	"{B2503C1D-AAFA-424b-B78F-53B44B60B188}"	""	"Batterij"	"{5934E0A6-C706-4a8a-9DF7-398F920B2995}"	"KlBatterijMateriaal"	"materiaal"	"Het materiaal waaruit de batterij gemaakt is. Het gaat hier om het materiaal waarin de lading opgeslagen is."	""	"materiaal"	"Het materiaal waaruit de batterij gemaakt is. Het gaat hier om het materiaal waarin de lading opgeslagen is."	""	""	"true"	"https://wegenenverkeer-test.data.vlaanderen.be/ns/onderdeel#"	"Batterij.materiaal"	"http://www.w3.org/2002/07/owl#ObjectProperty"	"https://wegenenverkeer-test.data.vlaanderen.be/ns/onderdeel#Batterij"	"http://www.w3.org/2004/02/skos/core#Concept"	""	"1"	"1"
"attribute"	"OSLO-Onderdeel"	"sluitkracht"	"{862B41F3-A09B-4733-8B1B-83ABD769E8BD}"	""	"Zelfsluiter"	"{249327B2-8847-40ef-9431-8A5F9DBD7BCE}"	"DtcZelfsluiterSluitkracht"	"sluitkracht"	"Geeft de mogelijkheden en instelling van het zelfsluitend mechanische aan."	""	"sluitkracht"	"Geeft de mogelijkheden en instelling van het zelfsluitend mechanische aan."	""	""	"true"	"https://wegenenverkeer-test.data.vlaanderen.be/ns/onderdeel#"	"Zelfsluiter.sluitkracht"	"http://www.w3.org/2002/07/owl#ObjectProperty"	"https://wegenenverkeer-test.data.vlaanderen.be/ns/onderdeel#Zelfsluiter"	"https://wegenenverkeer-test.data.vlaanderen.be/ns/onderdeel#DtcZelfsluiterSluitkracht"	""	"1"	"1"
"attribute"	"OSLO-Onderdeel"	"uitvoeringswijze"	"{3CF3ABCB-49E2-4711-B81B-D1D8BFA82BBE}"	""	"Zelfsluiter"	"{249327B2-8847-40ef-9431-8A5F9DBD7BCE}"	"KlZelfsluiterUitvoeringswijze"	"uitvoeringswijze"	"Geeft de stand van de deursluiter in het dagelijks gebruik aan."	""	"uitvoeringswijze"	"Geeft de stand van de deursluiter in het dagelijks gebruik aan."	""	""	"true"	"https://wegenenverkeer-test.data.vlaanderen.be/ns/onderdeel#"	"Zelfsluiter.uitvoeringswijze"	"http://www.w3.org/2002/07/owl#ObjectProperty"	"https://wegenenverkeer-test.data.vlaanderen.be/ns/onderdeel#Zelfsluiter"	"http://www.w3.org/2004/02/skos/core#Concept"	""	"1"	"1"
"attribute"	"OSLO-Onderdeel"	"heeftBadgelezer"	"{5874C92F-E449-4d7b-9306-CCF3012FF903}"	""	"Toegangscontrole"	"{FD8E4982-E803-4f0c-BDBE-258231315B9A}"	"Boolean"	"heeft badgelezer"	"Geeft aan of de toegangscontrole uitgerust is met een badgelezer."	""	"heeft badgelezer"	"Geeft aan of de toegangscontrole uitgerust is met een badgelezer."	""	""	"true"	"https://wegenenverkeer-test.data.vlaanderen.be/ns/onderdeel#"	"Toegangscontrole.heeftBadgelezer"	"http://www.w3.org/2002/07/owl#DatatypeProperty"	"https://wegenenverkeer-test.data.vlaanderen.be/ns/onderdeel#Toegangscontrole"	"http://www.w3.org/2001/XMLSchema#boolean"	""	"1"	"1"
"attribute"	"OSLO-Onderdeel"	"sleutelType"	"{29D92686-364E-4976-AD62-50F974F22907}"	""	"Toegangscontrole"	"{FD8E4982-E803-4f0c-BDBE-258231315B9A}"	"KlToegangscontroleSleuteltype"	"type sleutel"	"De soort sleutel die wordt gebruikt om de toegang te regelen."	""	"type sleutel"	"De soort sleutel die wordt gebruikt om de toegang te regelen."	""	""	"true"	"https://wegenenverkeer-test.data.vlaanderen.be/ns/onderdeel#"	"Toegangscontrole.sleutelType"	"http://www.w3.org/2002/07/owl#ObjectProperty"	"https://wegenenverkeer-test.data.vlaanderen.be/ns/onderdeel#Toegangscontrole"	"http://www.w3.org/2004/02/skos/core#Concept"	""	"1"	"1"
"attribute"	"OSLO-Onderdeel"	"heeftSlotMetAfstandsbediening"	"{E21C317E-0BE6-4d09-9404-D23F44638158}"	""	"Toegangscontrole"	"{FD8E4982-E803-4f0c-BDBE-258231315B9A}"	"Boolean"	"heeft slot met afstandsbediening"	"Geeft aan of het objecttype waaraan de toegangscontrole bevestigd is, kan geopend worden via een slot met afstandsbediening."	""	"heeft slot met afstandsbediening"	"Geeft aan of het objecttype waaraan de toegangscontrole bevestigd is, kan geopend worden via een slot met afstandsbediening."	""	""	"true"	"https://wegenenverkeer-test.data.vlaanderen.be/ns/onderdeel#"	"Toegangscontrole.heeftSlotMetAfstandsbediening"	"http://www.w3.org/2002/07/owl#DatatypeProperty"	"https://wegenenverkeer-test.data.vlaanderen.be/ns/onderdeel#Toegangscontrole"	"http://www.w3.org/2001/XMLSchema#boolean"	""	"1"	"1"
"attribute"	"OSLO-Abstracten"	"adres"	"{882D2DB2-2227-4c07-998F-DA5B244AFFEE}"	""	"Behuizing"	"{67A39958-2892-4f61-9857-45EA5FE9F26C}"	"DtcAdres"	"adres"	"Adres (aanduiding van de locatie) van de behuizing. Indien deze geen adres heeft, wordt net zoals door Fluvius voor cabines, het adres van een nabijgelegen straat genomen."	""	"adres"	"Adres (aanduiding van de locatie) van de behuizing. Indien deze geen adres heeft, wordt net zoals door Fluvius voor cabines, het adres van een nabijgelegen straat genomen."	""	""	"true"	"https://wegenenverkeer-test.data.vlaanderen.be/ns/abstracten#"	"Behuizing.adres"	"http://www.w3.org/2002/07/owl#ObjectProperty"	"https://wegenenverkeer-test.data.vlaanderen.be/ns/abstracten#Behuizing"	"https://wegenenverkeer-test.data.vlaanderen.be/ns/implementatieelement#DtcAdres"	""	"1"	"1"
"attribute"	"OSLO-Abstracten"	"risicoanalyse"	"{DFF58E2B-33C5-49e9-9E74-4E2D00EDD533}"	""	"Behuizing"	"{67A39958-2892-4f61-9857-45EA5FE9F26C}"	"DtcDocument"	"risicoanalyse"	"Een bestandsbijlage met de risicoanalyse voor werken in en rond een behuizing."	"De risicoanalyse heeft in eerste instantie betrekking op werken in en rond een behuizing met elektrische installaties. Voor behuizingen met installaties van de distributienetbeheerder wordt de risicoanalyse bestemd voor die beheerder, bewaard in het gelijknamig attribuut van het onderdeel van die beheerder, bv. EnergiemeterDNB."	"risicoanalyse"	"Een bestandsbijlage met de risicoanalyse voor werken in en rond een behuizing."	""	""	"true"	"https://wegenenverkeer-test.data.vlaanderen.be/ns/abstracten#"	"Behuizing.risicoanalyse"	"http://www.w3.org/2002/07/owl#ObjectProperty"	"https://wegenenverkeer-test.data.vlaanderen.be/ns/abstracten#Behuizing"	"https://wegenenverkeer-test.data.vlaanderen.be/ns/implementatieelement#DtcDocument"	""	"1"	"1"
"attribute"	"OSLO-Abstracten"	"tabelUitwendigeInvloeden"	"{0C161154-C21D-428f-B21A-59244D423940}"	""	"Behuizing"	"{67A39958-2892-4f61-9857-45EA5FE9F26C}"	"DtcDocument"	"tabel uitwendige invloeden"	"Een bestandsbijlage met de ingevulde en actuele tabel uitwendige invloeden zoals vereist door het AREI voor bepaalde elektrische installaties."	"De tabel is in eerste instantie enkel vereist voor behuizingen die elektrische installaties bevatten die onder het AREI vallen. "	"tabel uitwendige invloeden"	"Een bestandsbijlage met de ingevulde en actuele tabel uitwendige invloeden zoals vereist door het AREI voor bepaalde elektrische installaties."	""	""	"true"	"https://wegenenverkeer-test.data.vlaanderen.be/ns/abstracten#"	"Behuizing.tabelUitwendigeInvloeden"	"http://www.w3.org/2002/07/owl#ObjectProperty"	"https://wegenenverkeer-test.data.vlaanderen.be/ns/abstracten#Behuizing"	"https://wegenenverkeer-test.data.vlaanderen.be/ns/implementatieelement#DtcDocument"	""	"1"	"1"
"attribute"	"OSLO-Onderdeel"	"stroomkringnummer"	"{017681DA-30B0-4a99-B5EE-D4B6308B54D2}"	""	"Stroomkring"	"{24A2CB40-47FD-46fa-84E9-87E635ED1BFC}"	"String"	"stroomkringnummer"	"De identificatie van de stroomkring."	""	"stroomkringnummer"	"De identificatie van de stroomkring."	""	""	"true"	"https://wegenenverkeer-test.data.vlaanderen.be/ns/onderdeel#"	"Stroomkring.stroomkringnummer"	"http://www.w3.org/2002/07/owl#DatatypeProperty"	"https://wegenenverkeer-test.data.vlaanderen.be/ns/onderdeel#Stroomkring"	"http://www.w3.org/2001/XMLSchema#string"	""	"1"	"1"
"attribute"	"OSLO-Onderdeel"	"soortLamp"	"{D993A675-9A31-4a20-9656-3A570606567C}"	""	"Binnenverlichtingstoestel"	"{D9BD3A05-C65E-43ec-AAEA-D61FF890B77D}"	"KlBinnenverlichtingstoestelSoortLamp"	"soort lamp"	"Geeft aan welke soort lamp er gebruikt wordt in het binnenverlichtingstoestel."	""	"soort lamp"	"Geeft aan welke soort lamp er gebruikt wordt in het binnenverlichtingstoestel."	""	""	"true"	"https://wegenenverkeer-test.data.vlaanderen.be/ns/onderdeel#"	"Binnenverlichtingstoestel.soortLamp"	"http://www.w3.org/2002/07/owl#ObjectProperty"	"https://wegenenverkeer-test.data.vlaanderen.be/ns/onderdeel#Binnenverlichtingstoestel"	"http://www.w3.org/2004/02/skos/core#Concept"	""	"1"	"1"
"attribute"	"OSLO-Onderdeel"	"schakelwijze"	"{B816A0A2-03AE-46df-AC99-8A0DFC9907A3}"	""	"Binnenverlichtingstoestel"	"{D9BD3A05-C65E-43ec-AAEA-D61FF890B77D}"	"KlBinnenverlichtingstoestelSchakelwijze"	"schakelwijze"	"Geeft aan hoe het toestel aan- en uitgeschakeld wordt."	""	"schakelwijze"	"Geeft aan hoe het toestel aan- en uitgeschakeld wordt."	""	""	"true"	"https://wegenenverkeer-test.data.vlaanderen.be/ns/onderdeel#"	"Binnenverlichtingstoestel.schakelwijze"	"http://www.w3.org/2002/07/owl#ObjectProperty"	"https://wegenenverkeer-test.data.vlaanderen.be/ns/onderdeel#Binnenverlichtingstoestel"	"http://www.w3.org/2004/02/skos/core#Concept"	""	"1"	"1"
"attribute"	"OSLO-Onderdeel"	"config"	"{62246FA5-30EA-4806-9E65-2A3157BE8340}"	""	"Netwerkpoort"	"{2E04F022-D23F-4f64-B2B5-E78D3044EDAE}"	"KlNetwerkpoortConfig"	"config"	"Soort verbinding aangeboden aan de klant."	""	"config"	"Soort verbinding aangeboden aan de klant."	""	""	"true"	"https://wegenenverkeer-test.data.vlaanderen.be/ns/onderdeel#"	"Netwerkpoort.config"	"http://www.w3.org/2002/07/owl#ObjectProperty"	"https://wegenenverkeer-test.data.vlaanderen.be/ns/onderdeel#Netwerkpoort"	"http://www.w3.org/2004/02/skos/core#Concept"	""	"1"	"1"
"attribute"	"OSLO-Onderdeel"	"merk"	"{99283385-1FF2-4fbc-88CC-BA22A6C0B1E3}"	""	"Netwerkpoort"	"{2E04F022-D23F-4f64-B2B5-E78D3044EDAE}"	"KlNetwerkMerk"	"merk"	"Merk waarmee de fabrikant de netwerkpoort identificeert."	""	"merk"	"Merk waarmee de fabrikant de netwerkpoort identificeert."	""	""	"true"	"https://wegenenverkeer-test.data.vlaanderen.be/ns/onderdeel#"	"Netwerkpoort.merk"	"http://www.w3.org/2002/07/owl#ObjectProperty"	"https://wegenenverkeer-test.data.vlaanderen.be/ns/onderdeel#Netwerkpoort"	"http://www.w3.org/2004/02/skos/core#Concept"	""	"1"	"1"
"attribute"	"OSLO-Onderdeel"	"type"	"{3A5A08C0-5C02-4781-A953-849BF5D6D624}"	""	"Netwerkpoort"	"{2E04F022-D23F-4f64-B2B5-E78D3044EDAE}"	"KlNetwerkpoortType"	"model"	"Geeft het soort netwerk interface weer."	""	"model"	"Geeft het soort netwerk interface weer."	""	""	"true"	"https://wegenenverkeer-test.data.vlaanderen.be/ns/onderdeel#"	"Netwerkpoort.type"	"http://www.w3.org/2002/07/owl#ObjectProperty"	"https://wegenenverkeer-test.data.vlaanderen.be/ns/onderdeel#Netwerkpoort"	"http://www.w3.org/2004/02/skos/core#Concept"	""	"1"	"1"
"attribute"	"OSLO-Onderdeel"	"serienummer"	"{4685CEB7-D476-4b7e-BEA5-FE693FB5EF0D}"	""	"Netwerkpoort"	"{2E04F022-D23F-4f64-B2B5-E78D3044EDAE}"	"String"	"serienummer"	"Unieke identificatiecode van het toestel, toegekend door de fabrikant."	""	"serienummer"	"Unieke identificatiecode van het toestel, toegekend door de fabrikant."	""	""	"true"	"https://wegenenverkeer-test.data.vlaanderen.be/ns/onderdeel#"	"Netwerkpoort.serienummer"	"http://www.w3.org/2002/07/owl#DatatypeProperty"	"https://wegenenverkeer-test.data.vlaanderen.be/ns/onderdeel#Netwerkpoort"	"http://www.w3.org/2001/XMLSchema#string"	""	"1"	"1"
"attribute"	"OSLO-Onderdeel"	"technologie"	"{0D69D60F-02F8-48e2-A4F4-2208AE1B881C}"	""	"Netwerkpoort"	"{2E04F022-D23F-4f64-B2B5-E78D3044EDAE}"	"KlNetwerkTechnologie"	"technologie"	"Intern gebruikt netwerk protocol."	""	"technologie"	"Intern gebruikt netwerk protocol."	""	""	"true"	"https://wegenenverkeer-test.data.vlaanderen.be/ns/onderdeel#"	"Netwerkpoort.technologie"	"http://www.w3.org/2002/07/owl#ObjectProperty"	"https://wegenenverkeer-test.data.vlaanderen.be/ns/onderdeel#Netwerkpoort"	"http://www.w3.org/2004/02/skos/core#Concept"	""	"1"	"1"
"attribute"	"OSLO-Onderdeel"	"golflengte"	"{6B6378B1-D524-4e69-AC8E-ADED2F31B28F}"	""	"Netwerkpoort"	"{2E04F022-D23F-4f64-B2B5-E78D3044EDAE}"	"KlNetwerkpoortGolflengte"	"golflengte"	"De golflengte waarop deze poort communiceert."	""	"golflengte"	"De golflengte waarop deze poort communiceert."	""	""	"true"	"https://wegenenverkeer-test.data.vlaanderen.be/ns/onderdeel#"	"Netwerkpoort.golflengte"	"http://www.w3.org/2002/07/owl#ObjectProperty"	"https://wegenenverkeer-test.data.vlaanderen.be/ns/onderdeel#Netwerkpoort"	"http://www.w3.org/2004/02/skos/core#Concept"	""	"1"	"1"
"attribute"	"OSLO-Onderdeel"	"nNILANCapaciteit"	"{FF6D5D21-86BA-4d42-9AFF-800DBAF614D9}"	""	"Netwerkpoort"	"{2E04F022-D23F-4f64-B2B5-E78D3044EDAE}"	"Integer"	"NNI LAN-capaciteit"	"Bandbreedte via deze poort, uitgedrukt in Mb/s, enkel van toepassing indien NNI poort."	""	"NNI LAN-capaciteit"	"Bandbreedte via deze poort, uitgedrukt in Mb/s, enkel van toepassing indien NNI poort."	""	""	"true"	"https://wegenenverkeer-test.data.vlaanderen.be/ns/onderdeel#"	"Netwerkpoort.nNILANCapaciteit"	"http://www.w3.org/2002/07/owl#DatatypeProperty"	"https://wegenenverkeer-test.data.vlaanderen.be/ns/onderdeel#Netwerkpoort"	"http://www.w3.org/2001/XMLSchema#integer"	""	"1"	"1"
