"EA-Type"	"EA-Package"	"EA-Name"	"EA-GUID"	"EA-Parent"	"EA-Domain"	"EA-Domain-GUID"	"EA-Range"	"label"	"definition"	"usage"	"ap-label-nl"	"ap-definition-nl"	"ap-usageNote-nl"	"ap-codelist"	"external term"	"namespace"	"localname"	"type"	"domain"	"range"	"parent"	"min card"	"max card"
"Package"	""	"OSLO-Constructie-element"	"{59AC54A6-1C33-4cba-A679-37189CBFDC4F}"	""	""	""	""	""	""	""	""	""	""	""	""	"http://"	"fixme.com"	"http://www.w3.org/2002/07/owl#Ontology"	""	""	""	""	""
"CLASS"	"OSLO-Onderdeel"	"Breedplaat"	"{291EB400-315F-43e4-9619-F77BA7DAB112}"	""	""	""	""	"Breedplaat"	"Geprefabriceerd structuurelement dat over de volledige lengte voorzien is van minstens 2 driedimensionale tralieliggers en dat bestemd is om de meewerkende onderkant te vormen van een dragende brugdekplaat of van een bouwkundige constructie."	""	"Breedplaat"	"Geprefabriceerd structuurelement dat over de volledige lengte voorzien is van minstens 2 driedimensionale tralieliggers en dat bestemd is om de meewerkende onderkant te vormen van een dragende brugdekplaat of van een bouwkundige constructie."	""	""	"true"	"https://wegenenverkeer-test.data.vlaanderen.be/ns/onderdeel#"	"Breedplaat"	"http://www.w3.org/2000/01/rdf-schema#Class"	""	""	"https://wegenenverkeer-test.data.vlaanderen.be/ns/abstracten#ConstructieElement"	""	""
"CLASS"	"OSLO-Onderdeel"	"Druklaag"	"{5F27810F-B694-48b8-B096-F7F368BF3AE2}"	""	""	""	""	"Druklaag"	"Een betonnen afwerklaag die ter plaatste wordt gestort op een (betonnen) constructievloer."	""	"Druklaag"	"Een betonnen afwerklaag die ter plaatste wordt gestort op een (betonnen) constructievloer."	""	""	"true"	"https://wegenenverkeer-test.data.vlaanderen.be/ns/onderdeel#"	"Druklaag"	"http://www.w3.org/2000/01/rdf-schema#Class"	""	""	"https://wegenenverkeer-test.data.vlaanderen.be/ns/abstracten#ConstructieElement"	""	""
"CLASS"	"OSLO-Onderdeel"	"BetonnenPlaat"	"{9520E49A-7912-4f84-9F53-BBA8386E0598}"	"BetonnenConstructieObject"	""	""	""	"Betonnen plaat"	"Een vlak, plat betonnen enkelvoudig constructie-element."	""	"Betonnen plaat"	"Een vlak, plat betonnen enkelvoudig constructie-element."	""	""	"true"	"https://wegenenverkeer-test.data.vlaanderen.be/ns/onderdeel#"	"BetonnenPlaat"	"http://www.w3.org/2000/01/rdf-schema#Class"	""	""	"https://wegenenverkeer-test.data.vlaanderen.be/ns/onderdeel#BetonnenConstructieObject"	""	""
"CLASS"	"OSLO-Abstracten"	"ConstructiefObject"	"{A60DBF47-21F3-4347-9551-6AB088E9B907}"	""	""	""	""	"Constructief object"	"Een bundeling van alle constructieve installaties."	""	"Constructief object"	"Een bundeling van alle constructieve installaties."	""	""	"true"	"https://wegenenverkeer-test.data.vlaanderen.be/ns/abstracten#"	"ConstructiefObject"	"http://www.w3.org/2000/01/rdf-schema#Class"	""	""	"https://wegenenverkeer-test.data.vlaanderen.be/ns/abstracten#ConstructieElement"	""	""
"CLASS"	"OSLO-Onderdeel"	"BetonnenConstructieObject"	"{8CFAF1D8-5DD4-4cf7-BA3F-D45A38D2FA73}"	"BetonnenConstructieElement"	""	""	""	"Betonnen constructie object"	"Een generiek betonnen constructie-element dat op maat gemaakt is. Dit gaat niet over een (standaard) betonnen profiel of plaat, maar over een specifiek gevormd betonnen object."	""	"Betonnen constructie object"	"Een generiek betonnen constructie-element dat op maat gemaakt is. Dit gaat niet over een (standaard) betonnen profiel of plaat, maar over een specifiek gevormd betonnen object."	""	""	"true"	"https://wegenenverkeer-test.data.vlaanderen.be/ns/onderdeel#"	"BetonnenConstructieObject"	"http://www.w3.org/2000/01/rdf-schema#Class"	""	""	"https://wegenenverkeer-test.data.vlaanderen.be/ns/abstracten#ConstructieElement, https://wegenenverkeer-test.data.vlaanderen.be/ns/abstracten#BetonnenConstructieElement"	""	""
"CLASS"	"OSLO-Onderdeel"	"Metselwerk"	"{9D852B14-BD0F-4fc7-A7CC-FFA9D043B11E}"	""	""	""	""	"Metselwerk"	"Bouwconstructie met stenen waarbij metselspecie het verband tussen de stenen verzorgt."	""	"Metselwerk"	"Bouwconstructie met stenen waarbij metselspecie het verband tussen de stenen verzorgt."	""	""	"true"	"https://wegenenverkeer-test.data.vlaanderen.be/ns/onderdeel#"	"Metselwerk"	"http://www.w3.org/2000/01/rdf-schema#Class"	""	""	"https://wegenenverkeer-test.data.vlaanderen.be/ns/abstracten#ConstructieElement"	""	""
"CLASS"	"OSLO-Abstracten"	"BetonnenConstructieElement"	"{B42C960D-E743-4e77-B494-866492FF1DF0}"	""	""	""	""	"Betonnen constructie-element"	"Bundeling van gemeenschappelijke eigenschappen van betonnen constructie-elementen."	""	"Betonnen constructie-element"	"Bundeling van gemeenschappelijke eigenschappen van betonnen constructie-elementen."	""	""	"true"	"https://wegenenverkeer-test.data.vlaanderen.be/ns/abstracten#"	"BetonnenConstructieElement"	"http://www.w3.org/2000/01/rdf-schema#Class"	""	""	""	""	""
"CLASS"	"OSLO-Onderdeel"	"StalenConstructieObject"	"{B83C8005-E777-446d-B426-8A0BACDEC0A1}"	""	""	""	""	"Stalen constructie-object"	"Op maat gemaakt generiek stalen object dat dient ter constructie. Dit kan gemaakt zijn uit verschillende stalen delen aan elkaar gelast/gebout/... die één geheel vormen. Dit gaat niet over een standaard profiel of plaat, maar over een specifiek gevormd stalen object, zoals bijvoorbeeld: een stalen verbindingsknoop,..."	""	"Stalen constructie-object"	"Op maat gemaakt generiek stalen object dat dient ter constructie. Dit kan gemaakt zijn uit verschillende stalen delen aan elkaar gelast/gebout/... die één geheel vormen. Dit gaat niet over een standaard profiel of plaat, maar over een specifiek gevormd stalen object, zoals bijvoorbeeld: een stalen verbindingsknoop,..."	""	""	"true"	"https://wegenenverkeer-test.data.vlaanderen.be/ns/onderdeel#"	"StalenConstructieObject"	"http://www.w3.org/2000/01/rdf-schema#Class"	""	""	"https://wegenenverkeer-test.data.vlaanderen.be/ns/abstracten#ConstructieElement, https://wegenenverkeer-test.data.vlaanderen.be/ns/abstracten#StalenConstructieElement"	""	""
"CLASS"	"OSLO-Onderdeel"	"StalenPlaat"	"{0A859520-DF69-4e6e-B579-5C3F4B5B42D3}"	"StalenConstructieObject"	""	""	""	"Stalen plaat"	"Een vlak, plat stalen enkelvoudig constructie-element."	""	"Stalen plaat"	"Een vlak, plat stalen enkelvoudig constructie-element."	""	""	"true"	"https://wegenenverkeer-test.data.vlaanderen.be/ns/onderdeel#"	"StalenPlaat"	"http://www.w3.org/2000/01/rdf-schema#Class"	""	""	"https://wegenenverkeer-test.data.vlaanderen.be/ns/onderdeel#StalenConstructieObject"	""	""
"CLASS"	"OSLO-Installatie"	"Brugligger"	"{F7C9A99E-4FD3-4694-A8F1-5E31D5089343}"	"ConstructiefObject"	""	""	""	"Brugligger"	"Ondersteunende balkstructuur van een brug onder het brugdek."	""	"Brugligger"	"Ondersteunende balkstructuur van een brug onder het brugdek."	""	""	"true"	"https://wegenenverkeer-test.data.vlaanderen.be/ns/installatie#"	"Brugligger"	"http://www.w3.org/2000/01/rdf-schema#Class"	""	""	"https://wegenenverkeer-test.data.vlaanderen.be/ns/abstracten#ConstructiefObject"	""	""
"CLASS"	"OSLO-Installatie"	"Kolom"	"{3FE897CF-0F61-4d20-9921-037F97A82BCC}"	"ConstructiefObject"	""	""	""	"Kolom"	"Een verticale constructie die dient als drager en bestaat uit een zuil of pilaar."	""	"Kolom"	"Een verticale constructie die dient als drager en bestaat uit een zuil of pilaar."	""	""	"true"	"https://wegenenverkeer-test.data.vlaanderen.be/ns/installatie#"	"Kolom"	"http://www.w3.org/2000/01/rdf-schema#Class"	""	""	"https://wegenenverkeer-test.data.vlaanderen.be/ns/abstracten#ConstructiefObject"	""	""
"CLASS"	"OSLO-Onderdeel"	"HoutenConstructieprofiel"	"{7650876C-69C3-4508-A8EC-5CE4AFD4D07D}"	""	""	""	""	"Houten constructieprofiel"	"Houten enkelvoudig constructie-element waarvan de lengte vele malen groter is dan de breedte en de hoogte in doorsnede. De breedte is weer gelijk of kleiner dan de hoogte. Dit profiel heeft een dragende functie."	""	"Houten constructieprofiel"	"Houten enkelvoudig constructie-element waarvan de lengte vele malen groter is dan de breedte en de hoogte in doorsnede. De breedte is weer gelijk of kleiner dan de hoogte. Dit profiel heeft een dragende functie."	""	""	"true"	"https://wegenenverkeer-test.data.vlaanderen.be/ns/onderdeel#"	"HoutenConstructieprofiel"	"http://www.w3.org/2000/01/rdf-schema#Class"	""	""	"https://wegenenverkeer-test.data.vlaanderen.be/ns/abstracten#ConstructieElement, https://wegenenverkeer-test.data.vlaanderen.be/ns/abstracten#HoutenConstructieElement"	""	""
"CLASS"	"OSLO-Installatie"	"Balk"	"{386998B4-E4FC-4d10-BA1A-6481BA62D6C2}"	"ConstructiefObject"	""	""	""	"Balk"	"Ruimteoverspannend enkelvoudig constructie-element waarvan de lengte vele malen groter is dan de breedte en de hoogte in doorsnede. De breedte is weer gelijk of kleiner dan de hoogte."	""	"Balk"	"Ruimteoverspannend enkelvoudig constructie-element waarvan de lengte vele malen groter is dan de breedte en de hoogte in doorsnede. De breedte is weer gelijk of kleiner dan de hoogte."	""	""	"true"	"https://wegenenverkeer-test.data.vlaanderen.be/ns/installatie#"	"Balk"	"http://www.w3.org/2000/01/rdf-schema#Class"	""	""	"https://wegenenverkeer-test.data.vlaanderen.be/ns/abstracten#ConstructiefObject"	""	""
"CLASS"	"OSLO-Onderdeel"	"NietStandaardStalenProfiel"	"{B580FA1E-0739-4e73-9C2C-3AD873B88496}"	"StalenProfiel"	""	""	""	"Niet-standaard stalen profiel"	"Een stalen constructie-element waarvan de lengte vele malen groter is dan de breedte en de hoogte in doorsnede. Niet-standaard stalen profiel omvat alle speciale,op maat gemaakte en/of niet vaak voorkomende profielen."	""	"Niet-standaard stalen profiel"	"Een stalen constructie-element waarvan de lengte vele malen groter is dan de breedte en de hoogte in doorsnede. Niet-standaard stalen profiel omvat alle speciale,op maat gemaakte en/of niet vaak voorkomende profielen."	""	""	"true"	"https://wegenenverkeer-test.data.vlaanderen.be/ns/onderdeel#"	"NietStandaardStalenProfiel"	"http://www.w3.org/2000/01/rdf-schema#Class"	""	""	"https://wegenenverkeer-test.data.vlaanderen.be/ns/abstracten#StalenProfiel"	""	""
"CLASS"	"OSLO-Abstracten"	"StalenProfiel"	"{8D246C5F-6E03-49ac-ADA5-92E633E67D61}"	""	""	""	""	"Stalen profiel"	"Bundeling van gemeenschappelijke eigenschappen van standaard en niet-standaard stalen profiel."	""	"Stalen profiel"	"Bundeling van gemeenschappelijke eigenschappen van standaard en niet-standaard stalen profiel."	""	""	"true"	"https://wegenenverkeer-test.data.vlaanderen.be/ns/abstracten#"	"StalenProfiel"	"http://www.w3.org/2000/01/rdf-schema#Class"	""	""	"https://wegenenverkeer-test.data.vlaanderen.be/ns/abstracten#ConstructieElement, https://wegenenverkeer-test.data.vlaanderen.be/ns/abstracten#StalenConstructieElement, https://wegenenverkeer-test.data.vlaanderen.be/ns/abstracten#ConstructieElementenGC"	""	""
"CLASS"	"OSLO-Onderdeel"	"StandaardStalenProfiel"	"{45DCB714-B8C1-4b9f-A693-69932DBFF26D}"	"StalenProfiel"	""	""	""	"Standaard stalen profiel"	"Een stalen constructie-element waarvan de lengte vele malen groter is dan de breedte en de hoogte in doorsnede. Standaard stalen profiel omvat de meest genormeerde soorten profielen, zoals H-, I- en U-profielen met voorgedefinieerde profielhoogtematen."	""	"Standaard stalen profiel"	"Een stalen constructie-element waarvan de lengte vele malen groter is dan de breedte en de hoogte in doorsnede. Standaard stalen profiel omvat de meest genormeerde soorten profielen, zoals H-, I- en U-profielen met voorgedefinieerde profielhoogtematen."	""	""	"true"	"https://wegenenverkeer-test.data.vlaanderen.be/ns/onderdeel#"	"StandaardStalenProfiel"	"http://www.w3.org/2000/01/rdf-schema#Class"	""	""	"https://wegenenverkeer-test.data.vlaanderen.be/ns/abstracten#StalenProfiel"	""	""
"CLASS"	"OSLO-Installatie"	"HorizontaleConstructieplaat"	"{ADF0D1AC-FB86-4b90-98C7-7D20E151979E}"	"ConstructiefObject"	""	""	""	"Horizontale constructieplaat"	"Een plaat die dient ter constructie en die horizontaal wordt gebruikt. Deze omvat geen platen die met fundering te maken hebben (vb.: funderingsplaat, funderingszool,...)."	""	"Horizontale constructieplaat"	"Een plaat die dient ter constructie en die horizontaal wordt gebruikt. Deze omvat geen platen die met fundering te maken hebben (vb.: funderingsplaat, funderingszool,...)."	""	""	"true"	"https://wegenenverkeer-test.data.vlaanderen.be/ns/installatie#"	"HorizontaleConstructieplaat"	"http://www.w3.org/2000/01/rdf-schema#Class"	""	""	"https://wegenenverkeer-test.data.vlaanderen.be/ns/abstracten#ConstructiefObject"	""	""
"CLASS"	"OSLO-Onderdeel"	"BetonnenProfiel"	"{FDBFC6D9-1D0B-48e1-98F1-6CADF4AEE2FA}"	"BetonnenConstructieObject"	""	""	""	"Betonnen profiel"	"Betonnen enkelvoudig constructie-element waarvan de lengte vele malen groter is dan de breedte en de hoogte in doorsnede. De breedte is weer gelijk of kleiner dan de hoogte."	""	"Betonnen profiel"	"Betonnen enkelvoudig constructie-element waarvan de lengte vele malen groter is dan de breedte en de hoogte in doorsnede. De breedte is weer gelijk of kleiner dan de hoogte."	""	""	"true"	"https://wegenenverkeer-test.data.vlaanderen.be/ns/onderdeel#"	"BetonnenProfiel"	"http://www.w3.org/2000/01/rdf-schema#Class"	""	""	"https://wegenenverkeer-test.data.vlaanderen.be/ns/onderdeel#BetonnenConstructieObject"	""	""
"CLASS"	"OSLO-Installatie"	"Windverband"	"{ECA4F613-A9D4-4ed1-BE1E-0153B64CD933}"	"ConstructiefObject"	""	""	""	"Windverband"	"Ook: kruisverband. Stabiliteitsvoorziening om een constructie stijf te maken. Vangt windbelastingen, spatkrachten en dwarskrachten op. Ze bestaan meestal uit vrijwel onwrikbare (onvervormbare) driehoeken."	""	"Windverband"	"Ook: kruisverband. Stabiliteitsvoorziening om een constructie stijf te maken. Vangt windbelastingen, spatkrachten en dwarskrachten op. Ze bestaan meestal uit vrijwel onwrikbare (onvervormbare) driehoeken."	""	""	"true"	"https://wegenenverkeer-test.data.vlaanderen.be/ns/installatie#"	"Windverband"	"http://www.w3.org/2000/01/rdf-schema#Class"	""	""	"https://wegenenverkeer-test.data.vlaanderen.be/ns/abstracten#ConstructiefObject"	""	""
"CLASS"	"OSLO-Installatie"	"Wand"	"{96B03023-3C1D-4863-98FB-E5E25238A6A7}"	"ConstructiefObject"	""	""	""	"Wand"	"Een verticaal constructiedeel, vrijstaand of omsluitend die een afscheiding vormt, bv. tussen 2 ruimtes."	""	"Wand"	"Een verticaal constructiedeel, vrijstaand of omsluitend die een afscheiding vormt, bv. tussen 2 ruimtes."	""	""	"true"	"https://wegenenverkeer-test.data.vlaanderen.be/ns/installatie#"	"Wand"	"http://www.w3.org/2000/01/rdf-schema#Class"	""	""	"https://wegenenverkeer-test.data.vlaanderen.be/ns/abstracten#ConstructiefObject"	""	""
"CLASS"	"OSLO-Installatie"	"VakwerkElement"	"{612B3205-CC71-4785-A6E2-FCFA5701D1A7}"	"ConstructiefObject"	""	""	""	"Vakwerkelement"	"Element dat deel uitmaakt van een constructie waarbij balken en staven, volgens een stelsel van rechthoeken en/of driehoeken, aan de uiteinden en/of kruiselings verbonden worden tot een onwrikbaar geheel."	""	"Vakwerkelement"	"Element dat deel uitmaakt van een constructie waarbij balken en staven, volgens een stelsel van rechthoeken en/of driehoeken, aan de uiteinden en/of kruiselings verbonden worden tot een onwrikbaar geheel."	""	""	"true"	"https://wegenenverkeer-test.data.vlaanderen.be/ns/installatie#"	"VakwerkElement"	"http://www.w3.org/2000/01/rdf-schema#Class"	""	""	"https://wegenenverkeer-test.data.vlaanderen.be/ns/abstracten#ConstructiefObject"	""	""
"CLASS"	"OSLO-Abstracten"	"ConstructieElement"	"{917FBCD6-FAE5-4b0a-94ED-2D7B8053BE7C}"	""	""	""	""	"Constructie element"	"Abstracte voor de verschillende constructie elementen."	""	"Constructie element"	"Abstracte voor de verschillende constructie elementen."	""	""	"true"	"https://wegenenverkeer-test.data.vlaanderen.be/ns/abstracten#"	"ConstructieElement"	"http://www.w3.org/2000/01/rdf-schema#Class"	""	""	"https://wegenenverkeer-test.data.vlaanderen.be/ns/implementatieelement#AIMObject"	""	""
"CLASS"	"OSLO-Implementatieelement"	"AIMObject"	"{E988A721-4359-43b1-985E-AF081D82CB85}"	""	""	""	""	"AIM object"	"Abstracte als de basisklasse voor alle uniek geïdentificeerde OTL objecten met de basiseigenschappen die elk OTL object minstens heeft."	""	"AIM object"	"Abstracte als de basisklasse voor alle uniek geïdentificeerde OTL objecten met de basiseigenschappen die elk OTL object minstens heeft."	""	""	"true"	"https://wegenenverkeer-test.data.vlaanderen.be/ns/implementatieelement#"	"AIMObject"	"http://www.w3.org/2000/01/rdf-schema#Class"	""	""	"https://wegenenverkeer-test.data.vlaanderen.be/ns/implementatieelement#AIMToestand, https://wegenenverkeer-test.data.vlaanderen.be/ns/implementatieelement#AIMDBStatus"	""	""
"CLASS"	"OSLO-Implementatieelement"	"AIMToestand"	"{56AB9E47-A0BF-4e08-8CA5-0A50FB16E659}"	""	""	""	""	"AIM Toestand"	"Voegt een attribuut toe aan de subklasse dat de huidige stand in de levenscyclus van het object aangeeft."	""	"AIM Toestand"	"Voegt een attribuut toe aan de subklasse dat de huidige stand in de levenscyclus van het object aangeeft."	""	""	"true"	"https://wegenenverkeer-test.data.vlaanderen.be/ns/implementatieelement#"	"AIMToestand"	"http://www.w3.org/2000/01/rdf-schema#Class"	""	""	""	""	""
"CLASS"	"OSLO-Implementatieelement"	"AIMDBStatus"	"{0316AD39-D9FC-435c-8260-8E166A969FA4}"	""	""	""	""	"AIM databank status"	"Voegt een attribuut toe aan de subklasse dat aangeeft of de asset zichtbaar is in de databank of (zacht) verwijderd is."	""	"AIM databank status"	"Voegt een attribuut toe aan de subklasse dat aangeeft of de asset zichtbaar is in de databank of (zacht) verwijderd is."	""	""	"true"	"https://wegenenverkeer-test.data.vlaanderen.be/ns/implementatieelement#"	"AIMDBStatus"	"http://www.w3.org/2000/01/rdf-schema#Class"	""	""	""	""	""
"CLASS"	"OSLO-Abstracten"	"StalenConstructieElement"	"{810C31A2-6F8A-489f-8B4A-2CA4309AC4D2}"	""	""	""	""	"Stalen constructie-element"	"Bundeling van gemeenschappelijke eigenschappen van stalen constructie-elementen."	""	"Stalen constructie-element"	"Bundeling van gemeenschappelijke eigenschappen van stalen constructie-elementen."	""	""	"true"	"https://wegenenverkeer-test.data.vlaanderen.be/ns/abstracten#"	"StalenConstructieElement"	"http://www.w3.org/2000/01/rdf-schema#Class"	""	""	""	""	""
"CLASS"	"OSLO-Abstracten"	"HoutenConstructieElement"	"{0C431E36-3A17-4b24-9024-4398064E6A51}"	""	""	""	""	"Houten constructie-element"	"Bundeling van gemeenschappelijke eigenschappen van houten constructie-elementen."	""	"Houten constructie-element"	"Bundeling van gemeenschappelijke eigenschappen van houten constructie-elementen."	""	""	"true"	"https://wegenenverkeer-test.data.vlaanderen.be/ns/abstracten#"	"HoutenConstructieElement"	"http://www.w3.org/2000/01/rdf-schema#Class"	""	""	""	""	""
"CLASS"	"OSLO-Abstracten"	"ConstructieElementenGC"	"{4B6F0BB5-3BD1-4f57-8D62-FAFB01D0AFC4}"	""	""	""	""	"Constructie elementen geluidswerende constructie"	"Abstracte om de constructie-elementen te bundelen die gerelateerd zijn aan geluidswerende constructies."	""	"Constructie elementen geluidswerende constructie"	"Abstracte om de constructie-elementen te bundelen die gerelateerd zijn aan geluidswerende constructies."	""	""	"true"	"https://wegenenverkeer-test.data.vlaanderen.be/ns/abstracten#"	"ConstructieElementenGC"	"http://www.w3.org/2000/01/rdf-schema#Class"	""	""	""	""	""
"DATATYPE"	"OSLO-Implementatieelement"	"DtcBetonspecificaties"	"{DC48C08A-DC30-4fbe-BEC7-9AD6F57C8C38}"	""	""	""	""	"Betonspecificaties"	"Complex datatype om de eigenschappen van beton te bundelen. Deze omvat onder andere de verschillende betonklassen,hoe het beton gebruikt wordt,eigenschappen van het cement,een technische fiche van het beton,..."	""	"Betonspecificaties"	"Complex datatype om de eigenschappen van beton te bundelen. Deze omvat onder andere de verschillende betonklassen,hoe het beton gebruikt wordt,eigenschappen van het cement,een technische fiche van het beton,..."	""	""	"true"	"https://wegenenverkeer-test.data.vlaanderen.be/ns/implementatieelement#"	"DtcBetonspecificaties"	"http://www.w3.org/2000/01/rdf-schema#Class"	""	""	""	""	""
"DATATYPE"	"OSLO-Implementatieelement"	"KwantWrdInMillimeter"	"{AE04A0C4-258A-4401-B823-305832B572AC}"	""	""	""	""	"Kwantitatieve waarde in millimeter"	"Een kwantitatieve waarde die een getal in millimeter uitdrukt."	""	"Kwantitatieve waarde in millimeter"	"Een kwantitatieve waarde die een getal in millimeter uitdrukt."	""	""	"true"	"https://wegenenverkeer-test.data.vlaanderen.be/ns/implementatieelement#"	"KwantWrdInMillimeter"	"http://www.w3.org/2000/01/rdf-schema#Class"	""	""	""	""	""
"DATATYPE"	"W3-XML-Schema"	"Decimal"	"{3300D9AD-B706-43fe-B750-0EB2D8679F90}"	""	""	""	""	"Decimaal getal"	"Beschrijft een decimaal getal volgens http://www.w3.org/2001/XMLSchema#decimal."	"https://www.w3.org/TR/xmlschema-2/#decimal"	"Decimaal getal"	"Beschrijft een decimaal getal volgens http://www.w3.org/2001/XMLSchema#decimal."	""	""	"true"	"http://www.w3.org/2001/XMLSchema#"	"decimal"	"http://www.w3.org/2000/01/rdf-schema#Class"	""	""	""	""	""
"DATATYPE"	"W3-RDF-Schema"	"Literal"	"{FBE7CE2F-907F-4558-A0CE-70C0A8A6AA32}"	""	""	""	""	"Literal"	"Beschrijft een constante."	"http://www.w3.org/2000/01/rdf-schema#Literal"	"Literal"	"Beschrijft een constante."	""	""	"true"	"http://www.w3.org/2000/01/rdf-schema#"	"Literal"	"http://www.w3.org/2000/01/rdf-schema#Class"	""	""	""	""	""
"DATATYPE"	"W3-XML-Schema"	"Boolean"	"{C66810D0-4F93-4948-83F5-165137DEBF82}"	""	""	""	""	"Boolean"	"Beschrijft een boolean volgens http://www.w3.org/2001/XMLSchema#boolean."	"https://www.w3.org/TR/xmlschema-2/#boolean"	"Boolean"	"Beschrijft een boolean volgens http://www.w3.org/2001/XMLSchema#boolean."	""	""	"true"	"http://www.w3.org/2001/XMLSchema#"	"boolean"	"http://www.w3.org/2000/01/rdf-schema#Class"	""	""	""	""	""
"DATATYPE"	"OSLO-Implementatieelement"	"DtcDocument"	"{441527E2-4B20-4bca-899E-9DC151A2A981}"	""	""	""	""	"Bestandsbijlage"	"Complex datatype voor alle bestandsbijlages."	""	"Bestandsbijlage"	"Complex datatype voor alle bestandsbijlages."	""	""	"true"	"https://wegenenverkeer-test.data.vlaanderen.be/ns/implementatieelement#"	"DtcDocument"	"http://www.w3.org/2000/01/rdf-schema#Class"	""	""	""	""	""
"DATATYPE"	"W3-XML-Schema"	"AnyURI"	"{720ACC1F-344F-43bb-9B65-5467749150DD}"	""	""	""	""	"URI"	"Een tekstwaarde die een verwijzing naar meer informatie van het element bevat volgens http://www.w3.org/2001/XMLSchema#anyURI ."	"https://www.w3.org/TR/xmlschema-2/#anyURI"	"URI"	"Een tekstwaarde die een verwijzing naar meer informatie van het element bevat volgens http://www.w3.org/2001/XMLSchema#anyURI ."	""	""	"true"	"http://www.w3.org/2001/XMLSchema#"	"anyURI"	"http://www.w3.org/2000/01/rdf-schema#Class"	""	""	""	""	""
"DATATYPE"	"W3-XML-Schema"	"String"	"{9154C721-7D7C-4c11-8FBF-C56FAEF9A4DA}"	""	""	""	""	"String"	"Beschrijft een tekstregel volgens http://www.w3.org/2001/XMLSchema#string."	"https://www.w3.org/TR/xmlschema-2/#string"	"String"	"Beschrijft een tekstregel volgens http://www.w3.org/2001/XMLSchema#string."	""	""	"true"	"http://www.w3.org/2001/XMLSchema#"	"string"	"http://www.w3.org/2000/01/rdf-schema#Class"	""	""	""	""	""
"DATATYPE"	"OSLO-Implementatieelement"	"DteTekstblok"	"{E5E67991-BD15-468d-A90F-26B3A0821EF1}"	""	""	""	""	"Tekstblok"	"Een tekst welke uit meerdere zinnen bestaat, en ook regeleindes kan bevatten. Een tekstblok bevat maximaal 65.000 karakters."	""	"Tekstblok"	"Een tekst welke uit meerdere zinnen bestaat, en ook regeleindes kan bevatten. Een tekstblok bevat maximaal 65.000 karakters."	""	""	"true"	"https://wegenenverkeer-test.data.vlaanderen.be/ns/implementatieelement#"	"DteTekstblok"	"http://www.w3.org/2000/01/rdf-schema#Class"	""	""	""	""	""
"DATATYPE"	"OSLO-Implementatieelement"	"KwantWrdInVierkanteMeter"	"{ACAE1065-C7E9-4785-8C11-71E641483BDF}"	""	""	""	""	"Kwantitatieve waarde in vierkante meter"	"Een kwantitatieve waarde die een getal in vierkante meter uitdrukt."	""	"Kwantitatieve waarde in vierkante meter"	"Een kwantitatieve waarde die een getal in vierkante meter uitdrukt."	""	""	"true"	"https://wegenenverkeer-test.data.vlaanderen.be/ns/implementatieelement#"	"KwantWrdInVierkanteMeter"	"http://www.w3.org/2000/01/rdf-schema#Class"	""	""	""	""	""
"DATATYPE"	"OSLO-Implementatieelement"	"DtcIdentificator"	"{0A270AE5-3C56-44b7-8B06-DBC66BD6EB66}"	""	""	""	""	"Identificator"	"Complex datatype voor de identificator van een AIM object volgens de bron van de identificator."	""	"Identificator"	"Complex datatype voor de identificator van een AIM object volgens de bron van de identificator."	""	""	"true"	"https://wegenenverkeer-test.data.vlaanderen.be/ns/implementatieelement#"	"DtcIdentificator"	"http://www.w3.org/2000/01/rdf-schema#Class"	""	""	""	""	""
"DATATYPE"	"OSLO-Implementatieelement"	"KwantWrdInMaand"	"{990EC4F9-55FF-4c9b-A8FC-BD28BA132D95}"	""	""	""	""	"Kwantitatieve waarde in maand"	"Een kwantitatieve waarde die een getal in aantal maanden uitdrukt."	""	"Kwantitatieve waarde in maand"	"Een kwantitatieve waarde die een getal in aantal maanden uitdrukt."	""	""	"true"	"https://wegenenverkeer-test.data.vlaanderen.be/ns/implementatieelement#"	"KwantWrdInMaand"	"http://www.w3.org/2000/01/rdf-schema#Class"	""	""	""	""	""
"DATATYPE"	"W3-XML-Schema"	"NonNegativeInteger"	"{6B501216-6BB3-416b-8B5E-C532CB6FC474}"	""	""	""	""	"Natuurlijk getal"	"Beschrijft een natuurlijk getal volgens http://www.w3.org/2001/XMLSchema#nonNegativeInteger."	"https://www.w3.org/TR/xmlschema-2/#nonNegativeInteger"	"Natuurlijk getal"	"Beschrijft een natuurlijk getal volgens http://www.w3.org/2001/XMLSchema#nonNegativeInteger."	""	""	"true"	"http://www.w3.org/2001/XMLSchema#"	"nonNegativeInteger"	"http://www.w3.org/2000/01/rdf-schema#Class"	""	""	""	""	""
"DATATYPE"	"W3-XML-Schema"	"Date"	"{518CF17E-69E2-4b04-BFC0-208BB4C618A2}"	""	""	""	""	"Datum"	"Beschrijft een datum volgens http://www.w3.org/2001/XMLSchema#date."	"https://www.w3.org/TR/xmlschema-2/#date"	"Datum"	"Beschrijft een datum volgens http://www.w3.org/2001/XMLSchema#date."	""	""	"true"	"http://www.w3.org/2001/XMLSchema#"	"date"	"http://www.w3.org/2000/01/rdf-schema#Class"	""	""	""	""	""
